raw_scientificName,scientificName,rank,family,vernacularName,generalisation,category,kingdom,order,genus
Amytornis striatus striatus,Amytornis (Amytornis) striatus striatus,subspecies,MALURIDAE,Mukarrthippi Grasswren,10km,Category 2,Animalia,PASSERIFORMES,Amytornis
Amytornis striatus,Amytornis (Amytornis) striatus,species,MALURIDAE,Striated Grasswren,10km,Category 2,Animalia,PASSERIFORMES,Amytornis
Amytornis striatus howei,Amytornis (Magnamytis) striatus howei,subspecies,MALURIDAE,Murray Mallee Striated Grasswren,10km,Category 2,Animalia,PASSERIFORMES,Amytornis
Eucalyptus recurva Crisp,Eucalyptus recurva,species,MYRTACEAE,Mongarlowe Mallee,10km,Category 2,Plantae,Mytrales,Eucalyptus
"Diuris sp. (Oaklands, D.L. Jones 5380)",Diuris sp. Oaklands (Jones 5380),species,Orchidaceae,,10km,Category 2,Plantae,Asparagales,Diuris