taxonId,scientificName,sourceStatus,wa rank,epbc status,dbca region,dbca district,verbatimLocality,taxonRemarks,status,vernacularName,class,wa listing note,sensitivityZoneId
13250,Rhodanthe oppositifolia subsp. ornata,2,,,MWST,SHARK BAY,"Tamala, Shark Bay, Overlander",,P2 - Poorly known species,,,,
13264,Amyema pyriformis,1,,,KIMB,"EAST KIMBERLEY,WEST KIMBERLEY","Sale River, Katers Island, Bigge Island, Augustus Island",,P1 - Poorly known species,,,,
13269,Melaleuca fissurata,4,,,"SCST,WHTB","ESPERANCE,GREAT SOUTHERN","Mt Ney - Lake King, Scaddan, Truslove, Mt Ridley",,P4 - Poorly known species,,,,
13270,Melaleuca huegelii subsp. pristicensis,3,,,MWST,SHARK BAY,"Shark Bay, Dirk Hartog Island, Tamala",,P3 - Poorly known species,,,,
13274,Melaleuca ordinifolia,2,,,"SCST,WARR,WHTB","ALBANY,FRANKLAND,GREAT SOUTHERN","Cranbrook - Hamersley River, Stirling Range NP, Hay River",,P2 - Poorly known species,,,,
13276,Melaleuca pritzelii,3,,,"SCST,SWST,WARR,WHTB","ALBANY,DONNELLY,WELLINGTON,GREAT SOUTHERN","Ongerup, Pootenup, Tambellup, Fitzgerald River NP, Quarderwardup Lake, Lake Muir, Cordering, Stirling Range National Park, Ewlyamartup",,P3 - Poorly known species,,,,
13278,Melaleuca sculponeata,3,,,"SCST,WHTB","ALBANY,GREAT SOUTHERN","W of Ravensthorpe, Lake King",,P3 - Poorly known species,,,,
13279,Melaleuca viminea subsp. appressa,2,,,"SCST,WHTB","ALBANY,ESPERANCE,CENTRAL WHEATBELT","Mt Burdett, Ongerup, Skeleton Rock",,P2 - Poorly known species,,,,
13288,Schoenia filifolia subsp. arenicola,1,,,MWST,GERALDTON,"Carnarvon, Champion Bay",,P1 - Poorly known species,,,,
13290,Rhodanthe ascendens,1,,,"MWST,PILB","KARRATHA,GERALDTON","Gascoyne Junction, Middalya Station, Karijini N.P.",,P1 - Poorly known species,,,,
13302,Rhodanthe sphaerocephala,1,,,MWST,GERALDTON,"Belele, Meekatharra",,P1 - Poorly known species,,,,
13311,Rhodanthe frenchii,2,,,"MWST,PILB","KARRATHA,GERALDTON","Mt Augustus, Caprocorn Range, Barlee Range, Williambury Station",,P2 - Poorly known species,,,,
13338,Cynanchum christineae,1,,,KIMB,EAST KIMBERLEY,Mitchell  Platreau,,P1 - Poorly known species,,,,
13347,Leptospermum madidum subsp. sativum,3,,,KIMB,EAST KIMBERLEY,"Osmond Range, Purnululu N.P., Bedford Downs Stn., Prince Regent N.R.",,P3 - Poorly known species,,,,
13356,Schoenia filifolia subsp. subulifolia,T,EN,EN,MWST,GERALDTON,"Champion Bay, Geraldton",,Threatened Flora,,,,
13382,Drosera lasiantha,2,,,"SCST,WARR","ALBANY,FRANKLAND","Porongerup Range, Denmark",,P2 - Poorly known species,,,,
13383,Drosera nivea,1,,,MWST,MOORA,Coorow,,P1 - Poorly known species,,,,
13386,Drosera bicolor,1,,,"SCST,WHTB","ALBANY,GREAT SOUTHERN",Lake King,,P1 - Poorly known species,,,,
13420,Grevillea nana subsp. abbreviata,2,,,WHTB,CENTRAL WHEATBELT,"Wubin, Dowerin, Mukinbudin, Xantippe Reserve",,P2 - Poorly known species,,,,
13443,Grevillea adenotricha,4,,,KIMB,EAST KIMBERLEY,"Prince Regent River, MacDonald Range, Manning Gorge",,P4 - Poorly known species,,,,
13483,Pomaderris paniculosa subsp. paralia,2,,,SCST,ESPERANCE,"Recherche Archipelago, Eastern States",,P2 - Poorly known species,,,,
13495,Thomasia glabripetala,T,VU,VU,SWAN,PERTH HILLS,E of York,,Threatened Flora,,,,
13496,Philotheca langei,1,,,WHTB,CENTRAL WHEATBELT,Chiddarcooping,,P1 - Poorly known species,,,,
13497,Philotheca basistyla,T,CR,EN,WHTB,CENTRAL WHEATBELT,Trayning,,Threatened Flora,,,,
13498,Drummondita wilsonii,1,,,WHTB,CENTRAL WHEATBELT,Parker Range,,P1 - Poorly known species,,,,
13509,Acacia brachyphylla var. recurvata,3,,,"SCST,WHTB","ALBANY,GREAT SOUTHERN","Jerramungup, Nyabing, Kukerin, Pingrup, Highbury",,P3 - Poorly known species,,,,
13510,Eucalyptus cuprea,T,EN,EN,MWST,GERALDTON,Murchison River,,Threatened Flora,,,,
13512,Eucalyptus rudis subsp. cratyantha,4,,,"SWAN,SWST","BLACKWOOD,SWAN COASTAL","Yallingup, Eagle Bay, Mandurah, Cape Naturaliste, Meelup, Busselton, Serpentine",,P4 - Poorly known species,,,,
13515,Eucalyptus exigua,3,,,"GOLD,SCST,WHTB","KALGOORLIE,ESPERANCE,GREAT SOUTHERN,CENTRAL WHEATBELT","Lake Cronin, Hyden, Mt Day, Middle Ironcap, Lake Varley, Narembeen, Benari,Moorine Rock, Yellowdine, Jaurdi Stn., Mt Holland",,P3 - Poorly known species,,,,
13517,Eucalyptus dolichorhyncha,4,,,SCST,ESPERANCE,"Grass Patch, Scaddan, Salmon Gums",,P4 - Poorly known species,,,,
13520,Eucalyptus polita,3,,,"SCST,WHTB","ESPERANCE,GREAT SOUTHERN","Marvel Loch, Varley, Norseman",,P3 - Poorly known species,,,,
13522,Eucalyptus georgei subsp. georgei,4,,,SCST,ESPERANCE,"Mt Day, Newman Rock, Lake Johnston, Bremer Range",,P4 - Poorly known species,,,,
13523,Eucalyptus georgei subsp. fulgida,4,,,WHTB,GREAT SOUTHERN,"Hyden, Mt Holland, Lake Cronin,",,P4 - Poorly known species,,,,
13526,Eucalyptus crucis subsp. praecipua,T,EN,EN,MWST,GERALDTON,S of Paynes Find,,Threatened Flora,,,,
13531,Eucalyptus macrocarpa subsp. elachantha,4,,,MWST,"MOORA,GERALDTON","Mt Horner, Mt Adams, Eneabba, Badgingarra, Yandan Hill",,P4 - Poorly known species,,,,
13532,Eucalyptus impensa,T,CR,EN,MWST,MOORA,S of Eneabba,,Threatened Flora,,,,
13542,Eucalyptus articulata,T,EN,VU,GOLD,KALGOORLIE,NW of Queen Victoria Spring,,Threatened Flora,,,,
13543,Eucalyptus leprophloia,T,EN,EN,MWST,MOORA,Jurien,,Threatened Flora,,,,
13544,Eucalyptus zopherophloia,4,,,MWST,"MOORA,GERALDTON,SHARK BAY","Dongara, Cliff Head, Illawong, Jurien Bay, Peron Peninsula, Zuytdorp, Eurardy",,P4 - Poorly known species,,,,
13545,Eucalyptus angularis,2,,,MWST,MOORA,"Mt Lesueur, Mt Benia",,P2 - Poorly known species,,,,
13546,Eucalyptus dolorosa,T,CR,EN,MWST,MOORA,W of Dandaragan,,Threatened Flora,,,,
13550,Eucalyptus ebbanoensis subsp. photina,4,,,MWST,"MOORA,GERALDTON","Nanson, Mt Michael, Eradu, Mt Horner, Morseby Range",,P4 - Poorly known species,,,,
13564,Pavonia calycina,3,,,KIMB,"EAST KIMBERLEY,WEST KIMBERLEY","buckle Head, glycomis Bay, Bougainville Peninsula, Cape Rulhieres, Cape Bernier, Walcott Inlet.",,P3 - Poorly known species,,,,
13566,Typhonium nudibaccatum,1,,,KIMB,EAST KIMBERLEY,"Mitchell Plateau, Boongaree Is.",,P1 - Poorly known species,,,,
13571,Sporobolus blakei,3,,,"GOLD,KIMB,MWST","KALGOORLIE,GERALDTON,WEST KIMBERLEY","Mt Heart Stn.,Carnarvon, Warburton, Wongawal Stn.",,P3 - Poorly known species,,,,
13584,Swainsona disjuncta,1,,,SCST,ESPERANCE,Fraser Range,,P1 - Poorly known species,,,,
13598,Acacia setulifera,1,,,KIMB,EAST KIMBERLEY,East Kimberley,,P1 - Poorly known species,,,,
13601,Trymalium litorale,1,,,SCST,ALBANY,"Cape Riche, Bremer Bay",,P1 - Poorly known species,,,,
13610,Acacia leptalea,T,VU,EN,WHTB,GREAT SOUTHERN,"Nyabing, Chinocup",,Threatened Flora,,,,
13611,Acacia pygmaea,T,EN,EN,WHTB,CENTRAL WHEATBELT,Wongan Hills,,Threatened Flora,,,,
13614,Apium prostratum subsp. phillipii,T,EN,,SCST,ALBANY,Porongurups,,Threatened Flora,,,,
13615,Caladenia busselliana,T,CR,EN,SWST,BLACKWOOD,"Marybrook, Capel",,Threatened Flora,,,,
13616,Caladenia caesarea subsp. maritima,T,CR,EN,SWST,BLACKWOOD,Dunsborough,,Threatened Flora,,,,
13617,Caladenia christineae,T,EN,VU,"WARR,WHTB","DONNELLY,FRANKLAND,GREAT SOUTHERN","Manjimup-Mount Barker, Bridgetown, Lake Muir, Nuniup Lake",,Threatened Flora,,,,
13618,Caladenia elegans,T,CR,EN,MWST,GERALDTON,N of Northampton,,Threatened Flora,,,,
13619,Caladenia excelsa,T,EN,EN,SWST,BLACKWOOD,"Yallingup-Witchcliffe, Margaret River, Cowaramup, Gracetown",,Threatened Flora,,,,
13621,Caladenia harringtoniae,T,VU,VU,"SCST,SWST,WARR","BLACKWOOD,ALBANY,DONNELLY,FRANKLAND","Nannup-Albany, Lake Muir",,Threatened Flora,,,,
13622,Caladenia viridescens,T,CR,EN,SWST,BLACKWOOD,Dunsborough,,Threatened Flora,,,,
13630,Daviesia bursarioides,T,CR,EN,MWST,MOORA,Three Springs,,Threatened Flora,,,,
13631,Daviesia megacalyx,T,EN,EN,SCST,ALBANY,Ravensthorpe Range,,Threatened Flora,,,,
13632,Daviesia speciosa,T,EN,EN,MWST,"MOORA,GERALDTON","Eneabba-Carnarmah, Mingenew",,Threatened Flora,,,,
13633,Drakaea concolor,T,EN,VU,MWST,GERALDTON,"Murchison River, Kalbarri",,Threatened Flora,,,,
13634,Drakaea confluens,T,CR,EN,"SCST,SWST","BLACKWOOD,ALBANY,WELLINGTON","Boyup Brook, Stirling Range, Muja Conservation Park, Haddleton N.R.",,Threatened Flora,,,,
13635,Drakaea micrantha,T,EN,VU,"SCST,SWAN,SWST,WARR","BLACKWOOD,ALBANY,FRANKLAND,SWAN COASTAL,WELLINGTON","Perth-Augusta-Albany, Denmark, Margaret River",,Threatened Flora,,,,
13641,Eremophila caerulea subsp. merrallii,4,,,"GOLD,WHTB","KALGOORLIE,CENTRAL WHEATBELT","Bruce Rock, Jilbadji, Hunt Range, Burra Rock",,P4 - Poorly known species,,,,
13642,Eremophila subteretifolia,T,CR,EN,WHTB,GREAT SOUTHERN,"Lake Pallarup-Oldfield River, Lake Milarup",,Threatened Flora,,,,
13645,Eucalyptus platydisca,T,VU,VU,SCST,ESPERANCE,"Norseman, Mt Norcott",,Threatened Flora,,,,
13647,Lambertia echinata subsp. echinata,T,CR,EN,SCST,ESPERANCE,E of Esperance,,Threatened Flora,,,,
13653,Calytrix breviseta subsp. breviseta,T,CR,EN,SWAN,"PERTH HILLS,SWAN COASTAL","Kenwick (Gosnells, Bellevue)",,Threatened Flora,,,,
13656,Calytrix simplex subsp. simplex,1,,,SWAN,SWAN COASTAL,"Armadale, Mt Saddleback",,P1 - Poorly known species,,,,
13686,Drosera binata,2,,,"SWST,WARR","BLACKWOOD,DONNELLY,FRANKLAND","Pingerup Plains, Nornalup, Blackwood River NP, Walpole, Bow Bridge",,P2 - Poorly known species,,,,
13687,Thelymitra dedmaniarum,T,CR,EN,SWAN,"PERTH HILLS,SWAN COASTAL","Gidgegannup, Red Hill, Boonanarring NR",,Threatened Flora,,,,
13695,Cissus reniformis,3,,,KIMB,EAST KIMBERLEY,"Prince Regent N.R., Maret Is., Mt Trafalger, Mitchell Plateau, Bigge Is.",,P3 - Poorly known species,,,,
13705,Actinostachys digitata,2,,,KIMB,EAST KIMBERLEY,Drysdale River N.P.,,P2 - Poorly known species,,,,
13745,Decaisnina brittenii subsp. speciosa,3,,,KIMB,EAST KIMBERLEY,"Theda Stn., Drysdale River N.P., NT, Qld",,P3 - Poorly known species,,,,
13746,Croton arnhemicus,1,,,KIMB,EAST KIMBERLEY,"Doongan Stn., Wyndham, NT",,P1 - Poorly known species,,,,
13760,Iseilema trichopus,1,,,KIMB,EAST KIMBERLEY,Springdale Stn.,,P1 - Poorly known species,,,,
13765,Caustis gigas,2,,,MWST,MOORA,Alexander Morrison N.P.,,P2 - Poorly known species,,,,
13766,Caustis sp. Boyanup (G.S. McCutcheon 1706),3,,,"SCST,SWST,WARR,WHTB","BLACKWOOD,ALBANY,DONNELLY,WELLINGTON,GREAT SOUTHERN","Boyanup State Forest, Boscabel, Kojonup, Whicher NR, Vasse, S of Stirling Ranges, Donnybrook, tutanning NR, Blackwood River NP, Shannon NP",,P3 - Poorly known species,,,,
13773,Hopkinsia adscendens,3,,,SCST,ESPERANCE,Esperance to Lort River,,P3 - Poorly known species,,,,
13774,Lepidobolus densus,4,,,"MWST,WHTB","MOORA,GERALDTON,SHARK BAY,CENTRAL WHEATBELT","Coorow, Dirk Hartog Is., Shark Bay, Kalbarri NP, Three Springs, Morawa, Marchagee, Alexander Morrison N.P., North Wallambin,Billeranga Hills",,P4 - Poorly known species,,,,
13775,Lepidobolus quadratus,3,,,MWST,MOORA,"Eneabba, Gairdner Range, Regans Ford, Badgingarra",,P3 - Poorly known species,,,,
13777,Lepyrodia fortunata,2,,,SCST,ESPERANCE,Cape Le Grande N.P.,,P2 - Poorly known species,,,,
13779,Loxocarya magna,3,,,SWST,BLACKWOOD,"Scott River, Ruabon, Whicher, Fish Road, Treeton, Carbunup, Tutunup",,P3 - Poorly known species,,,,
13783,Thysanotus sp. Badgingarra (E.A. Griffin 2511),2,,,MWST,MOORA,"Badgingarra, Cockleshell Gully",,P2 - Poorly known species,,,,
13786,Microcybe pauciflora subsp. grandis,1,,,SCST,"ALBANY,ESPERANCE","Hatter Hill, Bandalup Hill",,P1 - Poorly known species,,,,
13788,Stylidium costulatum,3,,,KIMB,WEST KIMBERLEY,"Dampier Peninsula, Beverley Springs Stn, Mt Barnett Stn, Coulomb Point",,P3 - Poorly known species,,,,
13789,Stylidium pulviniforme,3,,,"SCST,WHTB","ESPERANCE,GREAT SOUTHERN,CENTRAL WHEATBELT","Dulagin Rock, Lake Johnston, Mt Madden, Lake King, Pallarup, Jerdacuttup, Weowanie Rock, Frank Hann NP, Peak Eleanora, Daniell, Pioneer, Lake Cobham, Salmon Gums",,P3 - Poorly known species,,,,
13809,Dendrolobium cheelii,3,,,KIMB,"EAST KIMBERLEY,WEST KIMBERLEY","Vansittart Bay, Drysdale River NP, Mitchell Plateau, Gibb River, Drysdale River Station, Kyulgam River",,P3 - Poorly known species,,,,
13810,Acrostichum aureum,1,,,KIMB,WEST KIMBERLEY,Meda Stn.,,P1 - Poorly known species,,,,
13812,Margaritaria dubium-traceyi,1,,,KIMB,EAST KIMBERLEY,"Bouganville Peninsula, NT, QLD",,P1 - Poorly known species,,,,
13819,Eremaea blackwelliana,4,,,SWAN,PERTH HILLS,"Clackline, Hoddy Well",,P4 - Poorly known species,,,,
13826,Cyanicula ixioides subsp. ixioides,4,,,"MWST,SWAN,WHTB","MOORA,PERTH HILLS,GREAT SOUTHERN","Beechina, Wooroloo, Datatine, Perth, Toodyay, Calingiri, Walpole, Gingin",,P4 - Poorly known species,,,,
13827,Cyanicula ixioides subsp. candida,2,,,SWAN,PERTH HILLS,"Bindoon, Smiths Mill, York, Wooroloo",,P2 - Poorly known species,,,,
13828,Drakaea isolata,T,CR,EN,WHTB,GREAT SOUTHERN,Lake Chinocup,,Threatened Flora,,,,
13829,Glycine pindanica,3,,,KIMB,EAST KIMBERLEY,"Broome, Beagle Bay",,P3 - Poorly known species,,,,
13850,Conostylis seorsiflora subsp. Nyabing (A. Coates s.n. 2/10/1988),2,,,WHTB,GREAT SOUTHERN,"Nyabing, Merilup NR",,P2 - Poorly known species,,,,
13852,Caladenia abbreviata,3,,,"SWST,WARR","BLACKWOOD,DONNELLY,FRANKLAND","Cosy Corner (Cape Hamelin), Lake Jasper, Crystal Springs, Gracetown, Augusta",,P3 - Poorly known species,,,,
13855,Caladenia caesarea subsp. transiens,1,,,WHTB,GREAT SOUTHERN,"Williams, [Newdegate], [Augusta], [Bowelling]",,P1 - Poorly known species,,,,
13856,Caladenia granitora,T,EN,EN,SCST,ALBANY,"Mount Manypeak N.R., Waychinocup N.P.",,Threatened Flora,,,,
13857,Caladenia hoffmanii,T,EN,EN,MWST,GERALDTON,Geraldton-Kalbarri,,Threatened Flora,,,,
13858,Caladenia interjacens,4,,,WARR,"DONNELLY,FRANKLAND","West Cliff Point, Crystal Spring, Walpole Nornalup",,P4 - Poorly known species,,,,
13861,Caladenia melanema,T,CR,CR,WHTB,GREAT SOUTHERN,"Pingrup, Lake Altham",,Threatened Flora,,,,
13862,Caladenia speciosa,4,,,"SWAN,SWST","BLACKWOOD,PERTH HILLS,SWAN COASTAL,WELLINGTON","Myalup, Eaton, Yarloop, Ludlow, Gingin, Capel",,P4 - Poorly known species,,,,
13863,Caladenia uliginosa subsp. patulens,1,,,"SWST,WARR","BLACKWOOD,DONNELLY,WELLINGTON","Harvey, Nannup, Kingston",,P1 - Poorly known species,,,,
13864,Caladenia winfieldii,T,EN,EN,WARR,DONNELLY,Strachan,,Threatened Flora,,,,
13867,Paracaleana dixonii,T,VU,EN,"MWST,SWAN","MOORA,SWAN COASTAL","Eneabba, Coomallo Creek, Sullivan Rock, Arrowsmith, Yandanooka, Moore River NP",,Threatened Flora,,,,
13891,Anigozanthos viridis subsp. terraspectans,T,VU,VU,"MWST,SWAN","MOORA,SWAN COASTAL","Cataby, Beermullah, Cooljarloo",,Threatened Flora,,,,
13895,Paspalidium retiglume,2,,,"KIMB,PILB","KARRATHA,EAST KIMBERLEY","Halls Creek, Chichester Range",,P2 - Poorly known species,,,,
13897,Allocasuarina eriochlamys subsp. grossa,3,,,"GOLD,SCST","KALGOORLIE,ESPERANCE","Zanthus, Lake Cowan, Norseman",,P3 - Poorly known species,,,,
13900,Grevillea uniformis,3,,,MWST,MOORA,"Mt Lesueur, Eneabba",,P3 - Poorly known species,,,,
13903,Sowerbaea alliacea,3,,,KIMB,EAST KIMBERLEY,"Prince Regent N.R., Mitchell Plateau, Drysdale River N.P.",,P3 - Poorly known species,,,,
13917,Acacia jasperensis,3,,,KIMB,EAST KIMBERLEY,"Berkeley River, Kununurra, N.T.",,P3 - Poorly known species,,,,
13941,Grevillea pythara,T,CR,EN,WHTB,CENTRAL WHEATBELT,Pithara,,Threatened Flora,,,,
13961,Pterocaulon globuliflorum,2,,,KIMB,WEST KIMBERLEY,Napier Range,,P2 - Poorly known species,,,,
13974,Wurmbea calcicola,T,VU,EN,SWST,BLACKWOOD,Cape Naturaliste,,Threatened Flora,,,,
13999,Conospermum undulatum,T,VU,VU,SWAN,"PERTH HILLS,SWAN COASTAL","Forrestfield, Orange Grove, Newburn, Lesmurdie, Maida Vale, Hazelmere",,Threatened Flora,,,,
14000,Conospermum densiflorum subsp. unicephalatum,T,EN,EN,MWST,MOORA,"Gingin, Gillingarra",,Threatened Flora,,,,
14002,Conospermum galeatum,T,CR,CR,WHTB,CENTRAL WHEATBELT,"Kellerberrin, Yilgarn",,Threatened Flora,,,,
14003,Conospermum quadripetalum,2,,,"SCST,SWST","BLACKWOOD,ALBANY","Scott River, Albany, Torndirrup",,P2 - Poorly known species,,,,
14004,Conospermum spectabile,2,,,SCST,ALBANY,Stirling Range,,P2 - Poorly known species,,,,
14010,Grevillea brachystylis subsp. australis,T,EN,VU,SWST,BLACKWOOD,Scott River,,Threatened Flora,,,,
14011,Grevillea brachystylis subsp. brachystylis,3,,,SWST,BLACKWOOD,"Busselton, Ruabon, Yoongarillup, Jarrahwood, Margaret River",,P3 - Poorly known species,,,,
14016,Olearia arguta var. arguta,3,,,KIMB,"EAST KIMBERLEY,WEST KIMBERLEY","Beverley Springs Stn., Kimbolton, Gibb River Stn.",,P3 - Poorly known species,,,,
14017,Olearia arguta var. lanata,3,,,KIMB,EAST KIMBERLEY,"Gibb River Stn., Mtichell Plateau, Berthier Is.",,P3 - Poorly known species,,,,
14025,Hemiandra sp. Kalbarri (D. Bellairs 1505),2,,,MWST,GERALDTON,Kalbarri NP,,P2 - Poorly known species,,,,
14042,Acacia sp. New Norcia (E.A. Griffin 5917),1,,,WHTB,CENTRAL WHEATBELT,New Norcia,,P1 - Poorly known species,,,,
14044,Acacia adinophylla,1,,,GOLD,KALGOORLIE,Helena and Aurora Range,,P1 - Poorly known species,,,,
14046,Acacia ampliata,1,,,MWST,GERALDTON,"Mullewa, Coolcalalaya",,P1 - Poorly known species,,,,
14047,Acacia amyctica,2,,,SCST,ESPERANCE,"Peak Charles NP, Salmon Gums",,P2 - Poorly known species,,,,
14048,Acacia ancistrophylla var. perarcuata,3,,,"SCST,WHTB","ESPERANCE,GREAT SOUTHERN,CENTRAL WHEATBELT","Bruce Rock, Carrabin, Mukinbudin, Korbel, Dundas, Mt Andrew,Nungarin, Westonia, Merredin",,P3 - Poorly known species,,,,
14049,Acacia aprica,T,CR,EN,MWST,MOORA,Carnamah - Coorow,,Threatened Flora,,,,
14050,Acacia arcuatilis,2,,,"SCST,WHTB","ALBANY,GREAT SOUTHERN","Camel Peaks, Kulin, Jitarning, Bendering, Pallarup River",,P2 - Poorly known species,,,,
14051,Acacia aristulata,T,EN,EN,MWST,MOORA,"Moora, Jingemia Hill",,Threatened Flora,,,,
14052,Acacia asepala,2,,,"SCST,WHTB","ESPERANCE,CENTRAL WHEATBELT","Frank Hann NP, Marvel Loch, Lake Cronin, Forrestiana",,P2 - Poorly known species,,,,
14053,Acacia auratiflora,T,VU,EN,WHTB,GREAT SOUTHERN,"Newdegate, Lake Grace",,Threatened Flora,,,,
14054,Acacia auripila,2,,,PILB,KARRATHA,Rudall River,,P2 - Poorly known species,,,,
14055,Acacia carens,2,,,MWST,MOORA,"Eneabba, Cockleshell Gully, Gairdner Range",,P2 - Poorly known species,,,,
14058,Acacia cerastes,1,,,MWST,GERALDTON,"Mt Gibson, Mt Singleton, White Wells",,P1 - Poorly known species,,,,
14059,Acacia chapmanii subsp. australis,T,EN,EN,"SWAN,WHTB","PERTH HILLS,CENTRAL WHEATBELT","Bolgart, Wyening",,Threatened Flora,,,,
14060,Acacia chapmanii subsp. chapmanii,2,,,MWST,MOORA,"Three Springs, Marchagee",,P2 - Poorly known species,,,,
14062,Acacia cochlocarpa subsp. cochlocarpa,T,CR,EN,MWST,MOORA,Watheroo,,Threatened Flora,,,,
14063,Acacia cochlocarpa subsp. velutinosa,T,CR,CR,WHTB,CENTRAL WHEATBELT,"Manmanning, Wongan Hills, Cunderdin",,Threatened Flora,,,,
14064,Acacia congesta subsp. cliftoniana,1,,,MWST,"MOORA,GERALDTON","Arrino, Yandanooka, Moora",,P1 - Poorly known species,,,,
14065,Acacia congesta subsp. wonganensis,2,,,WHTB,CENTRAL WHEATBELT,"Wongan Hills, Elphin",,P2 - Poorly known species,,,,
14066,Acacia cummingiana,3,,,"MWST,SWAN","MOORA,PERTH HILLS","Moora, Barberton, Badgingarra, Wannamal, Dandaragan, Watheroo N.P., Boonanaring",,P3 - Poorly known species,,,,
14067,Acacia cuneifolia,4,,,"SWAN,SWST,WHTB","PERTH HILLS,WELLINGTON,GREAT SOUTHERN","Pony Hill, Boyagin Rock, Wandoo CP, Collie, Kojonup",,P4 - Poorly known species,,,,
14068,Acacia cylindrica,3,,,"GOLD,WHTB","KALGOORLIE,CENTRAL WHEATBELT","Southern Cross, Mt Correll, Kulja, Hunt Range, Kalannie, Chiddarcooping N.R., Mollerin N.R., Mt Manning Range, Ennuin Stn.",,P3 - Poorly known species,,,,
14069,Acacia desertorum var. nudipes,3,,,"GOLD,WHTB","KALGOORLIE,CENTRAL WHEATBELT","Ghooli, Southern Cross, Yellowdine, Mt Dimer",,P3 - Poorly known species,,,,
14071,Acacia diminuta,1,,,SCST,"ALBANY,ESPERANCE","Scaddan, Truslove, Fitzgerald",,P1 - Poorly known species,,,,
14074,Acacia epedunculata,1,,,GOLD,KALGOORLIE,Caenyie Rock,,P1 - Poorly known species,,,,
14075,Acacia euthyphylla,3,,,SCST,ESPERANCE,"Clyde Hill, Truslove, Mt Ney, Mt Ridley",,P3 - Poorly known species,,,,
14076,Acacia formidabilis,3,,,"GOLD,MWST,WHTB","KALGOORLIE,GERALDTON,CENTRAL WHEATBELT","Wanarra, Perenjori, Paynes Find, Southern Cross, Warralackin, Bungalbin Hill",,P3 - Poorly known species,,,,
14077,Acacia gelasina,2,,,MWST,GERALDTON,"Kalbarri NP, Eurardy",,P2 - Poorly known species,,,,
14078,Acacia gloeotricha,1,,,KIMB,"EAST KIMBERLEY,WEST KIMBERLEY","Dimond Gorge, Fitzroy River",,P1 - Poorly known species,,,,
14080,Hypocalymma serrulatum,2,,,MWST,MOORA,"Badgingarra N.P., Hill River",,P2 - Poorly known species,,,,
14082,Persoonia brevirhachis,3,,,"SCST,WHTB","ALBANY,GREAT SOUTHERN","Lake Grace, Ravensthorpe, Newdegate, Burngup",,P3 - Poorly known species,,,,
14084,Persoonia chapmaniana,3,,,"MWST,WHTB","MOORA,CENTRAL WHEATBELT","Carnamah, Moora, Koorda, Marchagee, Eneabba, Kalannie",,P3 - Poorly known species,,,,
14085,Petrophile latericola,T,CR,EN,SWST,BLACKWOOD,"Ruabon, Williamson",,Threatened Flora,,,,
14087,Acacia cyperophylla var. omearana,1,,,PILB,KARRATHA,Nullagine,,P1 - Poorly known species,,,,
14110,Abutilon sp. Onslow (F. Smith s.n. 10/9/61),3,,,PILB,KARRATHA,"Onslow, Yaraloola Stn",,P3 - Poorly known species,,,,
14112,Abutilon sp. Hamelin (A.M. Ashby 2196),2,,,MWST,SHARK BAY,"Shark Bay, Hamelin Pool, Yaringa Stn",,P2 - Poorly known species,,,,
14114,Abutilon sp. Quobba (H. Demarz 3858),2,,,"MWST,PILB","EXMOUTH,GERALDTON,SHARK BAY","Quobba, Cape Range, Muggon Stn., Canarvon, Dorre Is., Gascoyne Junction",,P2 - Poorly known species,,,,
14117,Acacia heteroclita subsp. valida,2,,,SCST,ALBANY,Porongurup Range,,P2 - Poorly known species,,,,
14118,Acacia imitans,4,,EN,MWST,GERALDTON,"Mt Singleton, Mt Gibson, Ningham",,P4 - Poorly known species,,,,
14119,Acacia incanicarpa,2,,,SCST,ESPERANCE,"Mt Le Grand, Mt Merivale",,P2 - Poorly known species,,,,
14121,Acacia insolita subsp. recurva,T,CR,EN,WHTB,GREAT SOUTHERN,"East Yornaning NR, Narrogin",,Threatened Flora,,,,
14122,Acacia isoneura subsp. isoneura,3,,,"MWST,WHTB","MOORA,GERALDTON,CENTRAL WHEATBELT","Mingenew, Three Springs, Caron, Buntine, Perenjori, Wubin, Eurardy",,P3 - Poorly known species,,,,
14123,Acacia isoneura subsp. nimia,3,,,"MWST,WHTB","MOORA,GERALDTON,CENTRAL WHEATBELT","Billabong, Murchison River, Ajana, Coorow, Watheroo",,P3 - Poorly known species,,,,
14124,Acacia kenneallyi,3,,,KIMB,EAST KIMBERLEY,Bonaparte Archipelago,,P3 - Poorly known species,,,,
14125,Acacia mutabilis subsp. incurva,2,,,"SCST,WHTB","ALBANY,GREAT SOUTHERN","Ongerup, Pingrup, Needilup",,P2 - Poorly known species,,,,
14126,Acacia mutabilis subsp. rhynchophylla,3,,,WHTB,GREAT SOUTHERN,"Pingrup, Nyabing, Borden",,P3 - Poorly known species,,,,
14127,Acacia mutabilis subsp. stipulifera,3,,,"SCST,WHTB","ALBANY,GREAT SOUTHERN","Lake Cobham, Lake Bryde, Lake Magenta, Needilup",,P3 - Poorly known species,,,,
14128,Acacia obesa,3,,,WHTB,GREAT SOUTHERN,"Hyden, Lake King, Lake Grace",,P3 - Poorly known species,,,,
14129,Acacia oncinophylla subsp. oncinophylla,3,,,"MWST,SWAN,WARR","MOORA,DONNELLY,PERTH HILLS","Mogumber, Mundaring, John Forrest NP, Serpentine, Mt Lennard, Dwellingup, Winnejup",,P3 - Poorly known species,,,,
14130,Colubrina asiatica var. asiatica,1,,,KIMB,EAST KIMBERLEY,"Koolama Bay, NT, Qld, O.S.",,P1 - Poorly known species,,,,
14131,Acacia oncinophylla subsp. patulifolia,4,,,"SWAN,SWST,WARR","DONNELLY,PERTH HILLS,SWAN COASTAL,WELLINGTON","Gosnells, North Dandalup, Wagerup, Winnejup",,P4 - Poorly known species,,,,
14133,Acacia papulosa,2,,,SCST,ALBANY,"Boxwood Hill, Fitzgerald River",,P2 - Poorly known species,,,,
14134,Acacia pelophila,1,,,MWST,GERALDTON,"Northampton, Lynton",,P1 - Poorly known species,,,,
14136,Acacia plautella,3,,,MWST,GERALDTON,"Ajana, Wannoo Roadhouse, Murchison, Eurardy Station, Kalbarri NP, Cooloomia NR",,P3 - Poorly known species,,,,
14139,Acacia repanda,3,,,WHTB,"GREAT SOUTHERN,CENTRAL WHEATBELT","Lake Hurlstone, Lake Carmody, Wongan Hills, The Basin, Varley",,P3 - Poorly known species,,,,
14140,Acacia rhamphophylla,T,CR,EN,SCST,ALBANY,Kundip,,Threatened Flora,,,,
14141,Acacia singula,3,,,"SCST,WHTB","ESPERANCE,CENTRAL WHEATBELT","Lake Grace, Lake King, Hatter Hill, Pyramid Lake, South Ironcap, Digger Rocks, Frank Hann N.P.",,P3 - Poorly known species,,,,
14144,Acacia sp. Esperance (M.A. Burgman 1833b),1,,,SCST,ESPERANCE,N of Esperance,,P1 - Poorly known species,,,,
14145,Acacia stereophylla var. cylindrata,2,,,MWST,GERALDTON,Kalbarri NP,,P2 - Poorly known species,,,,
14146,Acacia subflexuosa subsp. capillata,T,CR,EN,WHTB,CENTRAL WHEATBELT,S of Cunderdin,,Threatened Flora,,,,
14147,Acacia subsessilis,3,,,MWST,GERALDTON,"Yalgoo, Fields Find",,P3 - Poorly known species,,,,
14148,Acacia tetraneura,1,,,WHTB,GREAT SOUTHERN,"Bruce Rock, Pingaring, Corrigin",,P1 - Poorly known species,,,,
14150,Acacia trulliformis,4,,,SCST,ALBANY,"Ongerup, Takalarup",,P4 - Poorly known species,,,,
14151,Acacia tuberculata,2,,,WHTB,GREAT SOUTHERN,"Mt Vernon, Camel Peaks, Hyden",,P2 - Poorly known species,,,,
14152,Acacia undosa,3,,,WHTB,"GREAT SOUTHERN,CENTRAL WHEATBELT","Belka, Lake King, Hyden, Lake Magenta, Tammin, Warralackin, Forrestania, Kondinin",,P3 - Poorly known species,,,,
14153,Acacia vittata,2,,,MWST,MOORA,"Lake Logue, Arrowsmith, Mount Kokeby",,P2 - Poorly known species,,,,
14154,Acacia wilsonii,T,EN,EN,MWST,MOORA,"Badgingarra, Alexander Morrison N.P., Eneabba",,Threatened Flora,,,,
14155,Abutilon sp. Warburton (A.S. George 8164),1,,,GOLD,KALGOORLIE,Warburton,,P1 - Poorly known species,,,,
14160,Acacia sclerophylla var. pilosa,2,,,WHTB,"GREAT SOUTHERN,CENTRAL WHEATBELT","Dumbleyung, Doodlakine, Tammin",,P2 - Poorly known species,,,,
14162,Acacia phlebopetala var. pubescens,2,,,SCST,ALBANY,Whoogarup Range,,P2 - Poorly known species,,,,
14179,Picris drummondii,1,,,SCST,ESPERANCE,Oldfield River,,P1 - Poorly known species,,,,
14180,Picris compacta,X,EX,,SWAN,SWAN COASTAL,"Claremont, Perth",,Presumed Extinct,,,,
14196,Eremophila cuneata,1,,,MWST,SHARK BAY,"Shark Bay, Dorre Island",,P1 - Poorly known species,,,,
14200,Daviesia lineata,2,,,WHTB,GREAT SOUTHERN,Lake Grace,,P2 - Poorly known species,,,,
