taxonId,scientificName,sourceStatus,wa rank,epbc status,dbca region,dbca district,verbatimLocality,taxonRemarks,status,vernacularName,class,wa listing note,sensitivityZoneId
31617.0,Tecticornia bulbosa,T,VU,VU,MWST,GERALDTON,Morawa-Koolanooka Hills,,Threatened Flora,,,,
31844.0,Tecticornia cymbiformis,3,,,"GOLD,MWST","KALGOORLIE,GERALDTON","Lake Anneen, Mt Margaret, Nannine, Yuin, Lorna Glen Stn.",,P3 - Poorly known species,,,,
49941.0,Tecticornia enodis,1,,,"GOLD,PILB","KALGOORLIE,KARRATHA",Little Sandy Desert,,P1 - Poorly known species,,,,
31715.0,Tecticornia entrichoma,4,,,SCST,ESPERANCE,Frank Hann N.P.,,P4 - Poorly known species,,,,
31714.0,Tecticornia fimbriata,3,,,"MWST,WHTB","MOORA,GREAT SOUTHERN,CENTRAL WHEATBELT","Morawa, Three Springs, Damboring, Cue, Perenjori, Gunyidi",,P3 - Poorly known species,,,,
31834.0,Tecticornia flabelliformis,2,,VU,"GOLD,WHTB","KALGOORLIE,CENTRAL WHEATBELT","Lake Yindarlgooda, Lake Deborah, Widgiemooltha, Eastern States",,P2 - Poorly known species,,,,
38509.0,Tecticornia globulifera,1,,,PILB,KARRATHA,Fortescue Marsh,,P1 - Poorly known species,,,,
31873.0,Tecticornia indefessa,2,,,SCST,ESPERANCE,Truslove,,P2 - Poorly known species,,,,
38511.0,Tecticornia medusa,3,,,PILB,KARRATHA,"Roy Hill, Fortescue Marsh",,P3 - Poorly known species,,,,
46514.0,Tecticornia mellarium,1,,,GOLD,KALGOORLIE,"Lake Carey, Little Sandy Desert",,P1 - Poorly known species,,,,
33578.0,Tecticornia papillata,1,,,GOLD,KALGOORLIE,"Blue Hill Stn, Carnarvon Range",,P1 - Poorly known species,,,,
34242.0,Tecticornia sp. Chinocup (K.A. Shepherd KS 1191),2,,,WHTB,GREAT SOUTHERN,Chinocup N.R.,,P2 - Poorly known species,,,,
34177.0,Tecticornia sp. Christmas Creek (K.A. Shepherd & T. Colmer et al. KS 1063),1,,,"GOLD,PILB","KALGOORLIE,KARRATHA","Fortescue Marsh, Roy Hill Stn, Little Sandy Desert",,P1 - Poorly known species,,,,
32998.0,Tecticornia sp. Coorow (P.G. Wilson 12750),1,,,MWST,MOORA,Coorow,,P1 - Poorly known species,,,,
34243.0,Tecticornia sp. Lake Wallambin (K.A. Shepherd KS 1157),1,,,WHTB,CENTRAL WHEATBELT,Lake Wallambin,,P1 - Poorly known species,,,,
34958.0,Tecticornia sp. Lake Way (P. Armstrong 05/961),1,,,GOLD,KALGOORLIE,Wiluna,,P1 - Poorly known species,,,,
31493.0,Tecticornia uniflora,4,,,"SCST,WARR,WHTB","ALBANY,FRANKLAND,GREAT SOUTHERN","Camel Lake, Stirling Range, Lake Cairlocup, Lake Magenta, Mt Barker",,P4 - Poorly known species,,,,
48698.0,Tecticornia willisii,1,,,GOLD,KALGOORLIE,Little Sandy Desert,,P1 - Poorly known species,,,,
46114.0,Telmatoblechnum indicum,1,,,KIMB,EAST KIMBERLEY,Kalumburu,,P1 - Poorly known species,,,,
20776.0,Tephrosia andrewii,3,,,"KIMB,PILB","KARRATHA,WEST KIMBERLEY","Port Hedland-Broome, La Grange",,P3 - Poorly known species,,,,
49714.0,Tephrosia cardiophylla,1,,,KIMB,EAST KIMBERLEY,Kununurra,,P1 - Poorly known species,,,,
50595.0,Tephrosia cowiei,1,,,KIMB,EAST KIMBERLEY,Durack River Station,,P1 - Poorly known species,,,,
50596.0,Tephrosia funicularis,3,,,KIMB,WEST KIMBERLEY,"Yampi Peninsula, Mt House Stn., Mornington Stn.",,P3 - Poorly known species,,,,
50601.0,Tephrosia lithosperma,1,,,PILB,KARRATHA,"Hamersley Range, N.T., QLD",,P1 - Poorly known species,,,,
48658.0,Tephrosia pedleyi,3,,,KIMB,WEST KIMBERLEY,"Broome, Camballin",,P3 - Poorly known species,,,,
42500.0,Tephrosia rosea var. Napier Range (C.R. Dunlop 7760 & B.K. Simon),3,,,KIMB,WEST KIMBERLEY,"Napier Range, Leopold Range, Springvale Stn, Mornington Stn.",,P3 - Poorly known species,,,,
41920.0,Tephrosia rosea var. Port Hedland (A.S. George 1114),1,,,PILB,KARRATHA,"Peeawah River, Finucane Is.",,P1 - Poorly known species,,,,
50654.0,Tephrosia sabulosa,1,,,PILB,KARRATHA,Gibson Desert,,P1 - Poorly known species,,,,
42482.0,Tephrosia sp. Central (P.K. Latz 17037),3,,,GOLD,KALGOORLIE,Gibson Desert,,P3 - Poorly known species,,,,
39423.0,Tephrosia sp. Kennedy Range (J.S. Beard 4392),1,,,MWST,GERALDTON,Williambury Stn.,,P1 - Poorly known species,,,,
39424.0,Tephrosia sp. Kununurra (T. Handasyde TH00 250),2,,,KIMB,EAST KIMBERLEY,"Theda Stn., Kununurra, Saw Ranges, Cockburn Range, Halls Creek",,P2 - Poorly known species,,,,
42226.0,Tephrosia sp. Mistake Creek (A.C. Beauglehole 54424),3,,,KIMB,EAST KIMBERLEY,"Osmond Range, Purnululu N.P., Carr Boyd Ranges, Argyle Stn.",,P3 - Poorly known species,,,,
46053.0,Tephrosia sp. North West Cape (G. Marsh 81),2,,,PILB,EXMOUTH,Exmouth,,P2 - Poorly known species,,,,
20777.0,Tephrosia valleculata,3,,,KIMB,EAST KIMBERLEY,"Derby, Keep River NP, Northern Territory, Mt Agnes, Moran River",,P3 - Poorly known species,,,,
45697.0,Terminalia kumpaja,3,,,KIMB,WEST KIMBERLEY,"Wallal Downs, Mandora Station, Dampier Peninsula",,P3 - Poorly known species,,,,
5313.0,Terminalia supranitifolia,3,,,PILB,KARRATHA,"Robe River, Burrup Peninsula, Dolphin Is., Bungaroo Creek, Yannery River, Harding Dam",,P3 - Poorly known species,,,,
16690.0,Tetragonia coronata,3,,,"KIMB,MWST","GERALDTON,SHARK BAY,WEST KIMBERLEY","Overlander Roadhouse, Hamelin Pool, Broome, Carey Downs Stn.",,P3 - Poorly known species,,,,
36284.0,Tetratheca affinis subsp. Cape Riche (T.D. Macfarlane TDM 1832),1,,,SCST,ALBANY,Cape Riche,,P1 - Poorly known species,,,,
23982.0,Tetratheca angulata,3,,,MWST,MOORA,"Boothendarra Hill, Alexander Morrison NP, Mt Lesueur, Badgingarra",,P3 - Poorly known species,,,,
29489.0,Tetratheca aphylla subsp. aphylla,T,VU,VU,GOLD,KALGOORLIE,Helena & Aurora Ranges,,Threatened Flora,,,,
29490.0,Tetratheca aphylla subsp. megacarpa,T,VU,VU,"SCST,WHTB","ESPERANCE,GREAT SOUTHERN","Newdegate, E Varley",,Threatened Flora,,,,
23986.0,Tetratheca applanata,1,,,"SCST,WHTB","ALBANY,GREAT SOUTHERN","Dardadine, Broomehill, Ravensthorpe",,P1 - Poorly known species,,,,
46773.0,Tetratheca butcheriana,1,,,PILB,KARRATHA,Tom Price,,P1 - Poorly known species,,,,
14665.0,Tetratheca chapmanii,1,,,GOLD,KALGOORLIE,Carnarvon Range,,P1 - Poorly known species,,,,
4529.0,Tetratheca deltoidea,T,CR,EN,WHTB,CENTRAL WHEATBELT,Mt Caroline,,Threatened Flora,,,,
20761.0,Tetratheca erubescens,T,EN,,GOLD,KALGOORLIE,Koolyanobbing,,Threatened Flora,,,,
31761.0,Tetratheca exasperata,3,,,"SWST,WHTB","WELLINGTON,GREAT SOUTHERN","Bowelling, Kojonup, Tincurrin, Duranillin",,P3 - Poorly known species,,,,
4532.0,Tetratheca fasciculata,X,EX,EX,WHTB,GREAT SOUTHERN,Lake Wagin,,Presumed Extinct,,,,
25768.0,Tetratheca fordiana,2,,,PILB,KARRATHA," West Angelas, Hamersley Range, Karijini N.P.",,P2 - Poorly known species,,,,
4534.0,Tetratheca harperi,T,VU,VU,GOLD,KALGOORLIE,Mt Jackson,,Threatened Flora,,,,
48340.0,Tetratheca hirsuta subsp. boonanarring,2,,,SWAN,SWAN COASTAL,Gingin,,P2 - Poorly known species,,,,
23989.0,Tetratheca nephelioides,T,EN,CR,MWST,MOORA,Eneabba,,Threatened Flora,,,,
4538.0,Tetratheca parvifolia,3,,,SWST,BLACKWOOD,"Capel, East of Donnybrook, Collie",,P3 - Poorly known species,,,,
23987.0,Tetratheca paynterae subsp. cremnobata,T,VU,EN,GOLD,KALGOORLIE,Die Hardy Ranges,,Threatened Flora,,,,
23988.0,Tetratheca paynterae subsp. paynterae,T,CR,EN,GOLD,KALGOORLIE,Windarling Range,,Threatened Flora,,,,
31781.0,Tetratheca phoenix,2,,,SWAN,PERTH HILLS,Mt Cooke,,P2 - Poorly known species,,,,
31778.0,Tetratheca pilata,1,,,SCST,ALBANY,Ongerup,,P1 - Poorly known species,,,,
4540.0,Tetratheca pilifera,3,,,SWAN,"PERTH HILLS,SWAN COASTAL","Two Rocks, Chidlow, John Forrest NP",,P3 - Poorly known species,,,,
34767.0,Tetratheca plumosa,1,,,WHTB,CENTRAL WHEATBELT,New Norcia,,P1 - Poorly known species,,,,
4542.0,Tetratheca remota,2,,,MWST,MOORA,"Lesueur N.P., Badgingarra",,P2 - Poorly known species,,,,
4543.0,Tetratheca retrorsa,3,,,WHTB,"GREAT SOUTHERN,CENTRAL WHEATBELT","Wongan Hills, Tutanning",,P3 - Poorly known species,,,,
4545.0,Tetratheca similis,3,,,SWAN,PERTH HILLS,"Bindoon, Mt Dale area, Wandoo CP",,P3 - Poorly known species,,,,
18383.0,Tetratheca sp. Kent River (B.G. Hammersley 1791),1,,,WARR,FRANKLAND,Kent River,,P1 - Poorly known species,,,,
33376.0,Tetratheca spartea,2,,,SWAN,PERTH HILLS,Julimar,,P2 - Poorly known species,,,,
41500.0,Tetratheca spenceri,T,VU,,GOLD,KALGOORLIE,Kambalda West,,Threatened Flora,,,,
49939.0,Teucrium diabolicum,3,,,"SCST,WHTB","ESPERANCE,CENTRAL WHEATBELT","Mt Gordon, Norseman, Southern Cross, Holleton",,P3 - Poorly known species,,,,
11317.0,Teucrium grandiusculum subsp. grandiusculum,2,,,"GOLD,MWST","KALGOORLIE,GERALDTON","Bell Rock Range, Gascoyne Rv",,P2 - Poorly known species,,,,
19366.0,Teucrium pilbaranum,2,,,PILB,KARRATHA,"Newman, Millstream-Chichester N.P., Mulga Downs Stn.",,P2 - Poorly known species,,,,
19394.0,Teucrium sp. Hutt River (W.H. Butler 54),1,,,MWST,GERALDTON,Hutt River,,P1 - Poorly known species,,,,
19395.0,Teucrium sp. Sturt Creek (A.A. Mitchell 5536),1,,,KIMB,EAST KIMBERLEY,Sturt Creek,,P1 - Poorly known species,,,,
34699.0,Thaumastochloa brassii,2,,,KIMB,EAST KIMBERLEY,Drysdale River N.P.,,P2 - Poorly known species,,,,
11032.0,Thelymitra apiculata,4,,,MWST,MOORA,"Badgingarra, Coomallo Creek, Gairdner Range, Stockyard Gully",,P4 - Poorly known species,,,,
13687.0,Thelymitra dedmaniarum,T,CR,EN,SWAN,"PERTH HILLS,SWAN COASTAL","Gidgegannup, Red Hill, Boonanarring NR",,Threatened Flora,,,,
14330.0,Thelymitra jacksonii,3,,,WARR,"DONNELLY,FRANKLAND","Walpole, Manjimup, Pingerup Plains, Mt Barker,",,P3 - Poorly known species,,,,
20729.0,Thelymitra magnifica,T,CR,,SWAN,PERTH HILLS,"Red Hill, Darling Range, Forrestfield",,Threatened Flora,,,,
50935.0,Thelymitra porphyrosticta,2,,,SCST,ALBANY,"Gull Rock, Two Peoples Bay, Bakers Junction",,P2 - Poorly known species,,,,
1713.0,Thelymitra psammophila,T,VU,VU,SCST,ALBANY,"Stirling Range-Ravensthorpe, Kamballup, Nalyerlup",,Threatened Flora,,,,
20734.0,Thelymitra pulcherrima,2,,,MWST,MOORA,"Watheroo, Lake Logue N.R., Lesueur N.P.",,P2 - Poorly known species,,,,
45933.0,Thelymitra sp. Ongerup (S. Oborne 142),3,,,"SCST,WHTB","ALBANY,GREAT SOUTHERN","Ongerup, Peniup, Arthur River, Kukerin, Corneecup N.R., Fitzgerald River N.P.",,P3 - Poorly known species,,,,
10862.0,Thelymitra stellata,T,EN,EN,"MWST,SWAN,WHTB","MOORA,PERTH HILLS,GREAT SOUTHERN","Perth-Three Springs, Pinjarra, Dumbleyung, Corrigin, Bungendore Park, Unnamed Shire Reserve 34155, Hartfield Rd, Mt Peron, Jurien Bay, Mt Lesueur NP, Arthur River, Coomallo NR, Julimar, Chittering, Armadale",,Threatened Flora,,,,
1717.0,Thelymitra variegata,2,,,"SCST,SWAN,SWST,WARR,WHTB","BLACKWOOD,ALBANY,FRANKLAND,SWAN COASTAL,GREAT SOUTHERN","Baldivis, Capel, Albany, Hyden, Mt Lindesay",,P2 - Poorly known species,,,,
29731.0,Thelymitra yorkensis,3,,,SWAN,PERTH HILLS,"York, Wandoo Conservation Park",,P3 - Poorly known species,,,,
17820.0,Themeda sp. Hamersley Station (M.E. Trudgen 11431),3,,,PILB,KARRATHA,"Karratha, Millstream, Hamersley Stn, West Angelas, Coondewanna Flats",,P3 - Poorly known species,,,,
50457.0,Themeda sp. Panorama (J. Nelson et al. NS 102) PN,1,,,PILB,KARRATHA,Spear Hill Marble Bar,,P1 - Poorly known species,,,,
8246.0,Thespidium basiflorum,1,,,KIMB,WEST KIMBERLEY,Dampier Peninsula,,P1 - Poorly known species,,,,
5076.0,Thomasia brachystachys,2,,,SCST,ALBANY,Stirling Range National Park,,P2 - Poorly known species,,,,
5078.0,Thomasia dielsii,1,,,WHTB,GREAT SOUTHERN,Cranbrook,,P1 - Poorly known species,,,,
5082.0,Thomasia gardneri,X,EX,EX,WHTB,CENTRAL WHEATBELT,Mt Holland,,Presumed Extinct,,,,
13495.0,Thomasia glabripetala,T,VU,VU,SWAN,PERTH HILLS,E of York,,Threatened Flora,,,,
49734.0,Thomasia julietiae,1,,,WHTB,GREAT SOUTHERN,Arthur River,,P1 - Poorly known species,,,,
5089.0,Thomasia montana,T,VU,VU,WHTB,GREAT SOUTHERN,"Hills E of York, Boyagin",,Threatened Flora,,,,
5090.0,Thomasia multiflora,1,,,SCST,ALBANY,"Albany, Warriup Hill",,P1 - Poorly known species,,,,
17049.0,Thomasia purpurea x solanacea,1,,,SCST,ALBANY,Albany,,P1 - Poorly known species,,,,
5095.0,Thomasia pygmaea,3,,,SCST,ALBANY,"Young River, Hamersley River, Eyre Range, Fitzgerald River NP",,P3 - Poorly known species,,,,
5096.0,Thomasia quercifolia,4,,,"SCST,WARR","ALBANY,FRANKLAND","Albany, Torndirrup NP, Walpole Nornalup N.P., Denmark, William Bay N.P.",,P4 - Poorly known species,,,,
5100.0,Thomasia solanacea,4,,,"SCST,WARR","ALBANY,FRANKLAND","Albany, Two Peoples Bay, Cape Riche, Stirling Range, Bald Is. N.R., Waychinnicup N.P., Bremer Bay, Mt Manypeaks N.R., Denmark",,P4 - Poorly known species,,,,
14248.0,Thomasia sp. Green Hill (S. Paust 1322),T,CR,EN,MWST,MOORA,New Norcia,,Threatened Flora,,,,
40141.0,Thomasia sp. Hopetoun (K.R. Newbey 4896),2,,,SCST,ALBANY,"Kundip, Thumb Peak",,P2 - Poorly known species,,,,
16288.0,Thomasia tenuivestita,3,,,"MWST,SWAN,WHTB","MOORA,GERALDTON,PERTH HILLS,GREAT SOUTHERN,CENTRAL WHEATBELT","Wongan Hills, Winchester, Bendering, York, Dingo Rock, Konongorring, Champion Bay, Boothendarra",,P3 - Poorly known species,,,,
5104.0,Thomasia triloba,1,,,UKN,Unknown,Uknown,,P1 - Poorly known species,,,,
5081.0,Thomasia x formosa,1,,,MWST,MOORA,Three Springs,,P1 - Poorly known species,,,,
44691.0,Thryptomene caduca,3,,,MWST,"GERALDTON,SHARK BAY","Womerangee Hill, Coburn, Tamala, Shark Bay",,P3 - Poorly known species,,,,
44683.0,Thryptomene calcicola,2,,,MWST,GERALDTON,Kalbarri N.P.,,P2 - Poorly known species,,,,
19697.0,Thryptomene duplicata,1,,,MWST,GERALDTON,Binnu,,P1 - Poorly known species,,,,
19695.0,Thryptomene eremaea,2,,,GOLD,KALGOORLIE,"Menzies, Queen Victoria Spring, Comet Vale, Edjudina Station, Kirgella Rocks",,P2 - Poorly known species,,,,
44690.0,Thryptomene hubbardii,3,,,MWST,GERALDTON,"Bindoo Hill, Mullewa, Yuna",,P3 - Poorly known species,,,,
9194.0,Thryptomene johnsonii,2,,,MWST,GERALDTON,Kalbarri,,P2 - Poorly known species,,,,
6062.0,Thryptomene nealensis,3,,,GOLD,KALGOORLIE,"Leinster, White Cliffs Stn, Neale Junction, Gt Victoria Desert",,P3 - Poorly known species,,,,
44685.0,Thryptomene nitida,3,,,MWST,"MOORA,GERALDTON","Arrino, Mingenew, Depot Hill",,P3 - Poorly known species,,,,
44699.0,Thryptomene orbiculata,3,,,MWST,GERALDTON,"East Yuna, Mingenew",,P3 - Poorly known species,,,,
44684.0,Thryptomene pinifolia,2,,,MWST,GERALDTON,Eurardy,,P2 - Poorly known species,,,,
49981.0,Thryptomene planiflora,1,,,GOLD,KALGOORLIE,"Coolgardie, Kambalda",,P1 - Poorly known species,,,,
44701.0,Thryptomene repens,2,,,MWST,SHARK BAY,"Shark Bay, Dirk Hartog",,P2 - Poorly known species,,,,
19694.0,Thryptomene salina,1,,,WHTB,GREAT SOUTHERN,Emu Rock,,P1 - Poorly known species,,,,
44702.0,Thryptomene shirleyae,2,,,MWST,MOORA,Carnamah,,P2 - Poorly known species,,,,
14350.0,Thryptomene sp. Carrarang (M.E. Trudgen 7420),1,,,MWST,SHARK BAY,"Tamala, Shark Bay, Carrarang",,P1 - Poorly known species,,,,
20680.0,Thryptomene sp. Coolgardie (E. Kelso s.n. 1902),1,,,"GOLD,WHTB","KALGOORLIE,CENTRAL WHEATBELT",Coolgardie,,P1 - Poorly known species,,,,
16820.0,Thryptomene sp. Eagle Gorge (A.G. Gunness 2360),2,,,MWST,"GERALDTON,SHARK BAY","Kalbarri, Zuytdorp",,P2 - Poorly known species,,,,
46953.0,Thryptomene sp. Hyden (B.J. Lepschi & L.A. Craven 4477),1,,,WHTB,GREAT SOUTHERN,Holleton,,P1 - Poorly known species,,,,
17266.0,Thryptomene sp. Lancelin (M.E. Trudgen 14000),3,,,MWST,MOORA,"Leeman, Lancelin, Jurien",,P3 - Poorly known species,,,,
20826.0,Thryptomene sp. Leinster (B.J. Lepschi & L.A. Craven 4362),3,,,GOLD,KALGOORLIE,Leinster,,P3 - Poorly known species,,,,
31276.0,Thryptomene sp. Mt Clara (R.J. Cranfield 11702),1,,,GOLD,KALGOORLIE,Mt Clara,,P1 - Poorly known species,,,,
35677.0,Thryptomene sp. Wandana (M.E. Trudgen MET 22016),3,,,MWST,"MOORA,GERALDTON","Eurardy, Yuna, Mt Singleton,Wandana NR, Kalbarri, Perenjori, McGaurans NR",,P3 - Poorly known species,,,,
46054.0,Thryptomene sp. Warburton (M. Henson & M. Hannart 32433),1,,,GOLD,KALGOORLIE,Warburton,,P1 - Poorly known species,,,,
44700.0,Thryptomene spicata,2,,,MWST,MOORA,Eneabba,,P2 - Poorly known species,,,,
44704.0,Thryptomene stapfii,3,,,MWST,GERALDTON,"Moresby Range, Chapman Valley, Howatharra",,P3 - Poorly known species,,,,
6066.0,Thryptomene stenophylla,2,,,MWST,GERALDTON,"Kalbarri, Geraldton",,P2 - Poorly known species,,,,
19693.0,Thryptomene striata,2,,,MWST,GERALDTON,Kalbarri,,P2 - Poorly known species,,,,
44689.0,Thryptomene velutina,2,,,MWST,GERALDTON,"East Yuna Reserve, East Chapman, Bella Vista NR",,P2 - Poorly known species,,,,
44705.0,Thryptomene wannooensis,1,,,MWST,GERALDTON,Wannoo,,P1 - Poorly known species,,,,
6069.0,Thryptomene wittweri,T,VU,VU,"GOLD,MWST,PILB","KALGOORLIE,KARRATHA,GERALDTON","Hamersley Range, Mt Augustus, Carnarvon Range, White Cliffs Stn, NT",,Threatened Flora,,,,
1316.0,Thysanotus acerosifolius,2,,,WHTB,GREAT SOUTHERN,"Newdegate, Pallarup Rocks, Lake Magenta",,P2 - Poorly known species,,,,
1317.0,Thysanotus anceps,3,,,"MWST,SWAN","MOORA,PERTH HILLS","John Forrest, Brookton Highway, Coomallo Creek, Mt Lesueur",,P3 - Poorly known species,,,,
1321.0,Thysanotus banksii,1,,,KIMB,EAST KIMBERLEY,"Mitchell Plateau, Northern Territory, Queensland, New Guinea",,P1 - Poorly known species,,,,
1322.0,Thysanotus baueri,1,,,"GOLD,SCST","KALGOORLIE,ESPERANCE","E of Zanthus, Nuytsland N.R.",,P1 - Poorly known species,,,,
1323.0,Thysanotus brachiatus,2,,,SCST,"ALBANY,ESPERANCE","Munglinup, Ravensthorpe, Hopetoun, Dalyup",,P2 - Poorly known species,,,,
1324.0,Thysanotus brachyantherus,2,,,"SCST,WHTB","ESPERANCE,GREAT SOUTHERN","Mt Ragged, Mt Heywood, Karlgarin",,P2 - Poorly known species,,,,
1325.0,Thysanotus brevifolius,2,,,SCST,ALBANY,South Stirling Range,,P2 - Poorly known species,,,,
1327.0,Thysanotus cymosus,3,,,WHTB,"GREAT SOUTHERN,CENTRAL WHEATBELT","Muntadgin, Karlgarin, Hyden, Lake Grace, Ongerup, Kulin, Pingelly, Kojonup, Popanyinning, Arthur River",,P3 - Poorly known species,,,,
1331.0,Thysanotus formosus,1,,,"SWST,WARR","BLACKWOOD,DONNELLY","Nannup, Northcliffe",,P1 - Poorly known species,,,,
46755.0,Thysanotus fragrans,2,,,MWST,GERALDTON,"Kalbarri, Mileura, Moorarie",,P2 - Poorly known species,,,,
1332.0,Thysanotus gageoides,3,,,"SCST,SWST,WHTB","BLACKWOOD,ALBANY,GREAT SOUTHERN","Cranbrook, Cape Riche, Stirling Range, Borden, Ongerup, Mullalyup, Corackerup, Boxwood Hill",,P3 - Poorly known species,,,,
1334.0,Thysanotus glaucus,4,,,"MWST,SCST,SWAN,SWST,WHTB","BLACKWOOD,ALBANY,ESPERANCE,MOORA,PERTH HILLS,SWAN COASTAL,GREAT SOUTHERN","Regans Ford, Forrestdale, Busselton, Lake King, West Mt Barren, Lesueur NPk",,P4 - Poorly known species,,,,
1336.0,Thysanotus isantherus,4,,,"SCST,SWAN,SWST,WARR","BLACKWOOD,ALBANY,FRANKLAND,PERTH HILLS","Mt Melville, Mt Clarence, Torndirrup N.P., Albany, Mt Lindesay N.P., Shannon River, Kent River, Gull Rock, Cowaremup, Red Hill",,P4 - Poorly known species,,,,
49710.0,Thysanotus kalbarriensis,2,,,MWST,GERALDTON,Kalbarri NP,,P2 - Poorly known species,,,,
1337.0,Thysanotus lavanduliflorus,1,,,WHTB,GREAT SOUTHERN,Newdegate,,P1 - Poorly known species,,,,
1342.0,Thysanotus parviflorus,4,,,SCST,"ALBANY,ESPERANCE","West Mt Barren, Cape Arid, Stirling Range Drive",,P4 - Poorly known species,,,,
1349.0,Thysanotus sabulosus,1,,,WHTB,GREAT SOUTHERN,"Newdegate, Lake Grace",,P1 - Poorly known species,,,,
13783.0,Thysanotus sp. Badgingarra (E.A. Griffin 2511),2,,,MWST,MOORA,"Badgingarra, Cockleshell Gully",,P2 - Poorly known species,,,,
14391.0,Thysanotus sp. Desert East of Newman (R.P. Hart 964),2,,,"GOLD,PILB","KALGOORLIE,KARRATHA","Warburton, Gibson Desert, Collier Range, Rudall River",,P2 - Poorly known species,,,,
49058.0,Thysanotus sp. Ennuin (N. Gibson & M. Lyons 2665),1,,,WHTB,CENTRAL WHEATBELT,Bullfinch,,P1 - Poorly known species,,,,
49163.0,Thysanotus sp. Mount Madden (G.F. Craig 10516),1,,,SCST,ALBANY,Ravensthorpe,,P1 - Poorly known species,,,,
49067.0,Thysanotus sp. Yellowdine (A.S. George 6040),2,,,"GOLD,WHTB","KALGOORLIE,GREAT SOUTHERN","Hyden, Boorabbin",,P2 - Poorly known species,,,,
1355.0,Thysanotus tenuis,3,,,"SWAN,WHTB","PERTH HILLS,GREAT SOUTHERN,CENTRAL WHEATBELT","Northam, Wagin, Tincurrin, Pingelly, Toolibin NR, Harrismith, Kukerin, Mukinbudin, Wickepin, Tammin, beverley, Mt Kokeby, Kellerberrin, Bencubbin, Nungarin, quairading, Doodlakine,Narembeen, Cunderdin, Kununoppin",,P3 - Poorly known species,,,,
35519.0,Thysanotus unicupensis,3,,,"SWST,WARR","BLACKWOOD,DONNELLY,WELLINGTON","Boyup Brook, Collie, Unicup, Kingston, Mullalyup",,P3 - Poorly known species,,,,
1359.0,Thysanotus vernalis,3,,,MWST,MOORA,"Gairdner Range, Badgingarra, Mingenew, Eneabba, Wongonderrah",,P3 - Poorly known species,,,,
40280.0,Thysanotus volubilis,2,,,SCST,ESPERANCE,Cape Le Grand N.P.,,P2 - Poorly known species,,,,
17345.0,Tinospora esiangkara,2,,,PILB,EXMOUTH,"Cape Range, NT, Qld",,P2 - Poorly known species,,,,
19047.0,Trachymene anisocarpa var. trichocarpa,3,,,SCST,ESPERANCE,"Esperance, Cape Arid NP, Cape Le Grand NP, Kau Rock",,P3 - Poorly known species,,,,
6267.0,Trachymene croniniana,3,,,"SCST,WHTB","ALBANY,ESPERANCE,GREAT SOUTHERN,CENTRAL WHEATBELT","Stirling Range, Bruce Rock, Muntadgin, Lake Grace",,P3 - Poorly known species,,,,
6271.0,Trachymene dusenii,3,,,KIMB,EAST KIMBERLEY,"Halls Creek, Springvale Stn, Northern Territory",,P3 - Poorly known species,,,,
51202.0,Trachymene oleracea subsp. sedimentum,1,,,KIMB,EAST KIMBERLEY,"Napier Range, Wyndham",,P1 - Poorly known species,,,,
45741.0,Trachymene pavimentum,1,,,KIMB,EAST KIMBERLEY,Theda Station,,P1 - Poorly known species,,,,
19044.0,Trachymene pyrophila,2,,,GOLD,KALGOORLIE,"Cundeelee Mission, Queen Victoria Springs, Zanthus",,P2 - Poorly known species,,,,
6281.0,Trachymene villosa,1,,,KIMB,EAST KIMBERLEY,"Gordon Downs Stn, N.T.",,P1 - Poorly known species,,,,
12240.0,Trianthema kimberleyi,1,,,KIMB,EAST KIMBERLEY,Fitzroy Crossing - Halls Creek (Christmas Creek Station),,P1 - Poorly known species,,,,
34956.0,Trianthema sp. Bachsten Creek (R.L. Barrett & M.D. Barrett RLB 3824),2,,,KIMB,EAST KIMBERLEY,Prince Regent N.R.,,P2 - Poorly known species,,,,
34957.0,Trianthema sp. Mitchell Plateau (P.A. Fryxell et al. 4723),1,,,KIMB,EAST KIMBERLEY,Mitchell Plateau,,P1 - Poorly known species,,,,
33278.0,Trianthema sp. Python Pool (G.R. Guerin & M.E. Trudgen GG 1023),2,,,PILB,KARRATHA,"Millstream-chicester N.P., Mt Welcome Stn.",,P2 - Poorly known species,,,,
29613.0,Tribonanthes minor,3,,,WHTB,GREAT SOUTHERN,"Chinnocup, Lake King",,P3 - Poorly known species,,,,
1484.0,Tribonanthes purpurea,T,VU,VU,"SCST,SWAN,WHTB","ALBANY,PERTH HILLS,GREAT SOUTHERN","Pingaring, Hillman T/S, Mt Dale, Albany",,Threatened Flora,,,,
45773.0,Tribulopis marliesiae,3,,,KIMB,WEST KIMBERLEY,"Great Sandy Desert, Anna Plains, Roebuck Plains Station",,P3 - Poorly known species,,,,
19138.0,Tribulopis sp. Koolan Island (K.F. Kenneally 8278),1,,,KIMB,WEST KIMBERLEY,Sunday Island,,P1 - Poorly known species,,,,
19139.0,Tribulopis sp. Mitchell Plateau (K.F. Kenneally 7935),1,,,KIMB,EAST KIMBERLEY,Mitchell Plateau,,P1 - Poorly known species,,,,
18065.0,Tribulus adelacanthus,3,,,"GOLD,MWST","KALGOORLIE,GERALDTON","Wiluna, Robinson Range, Mt Magnet, Mt Keith Stn.",,P3 - Poorly known species,,,,
18068.0,Tribulus minutus,1,,,PILB,KARRATHA,Nullagine,,P1 - Poorly known species,,,,
40862.0,Trichosanthes pilosa,1,,,KIMB,EAST KIMBERLEY,"Mitchell Plateau, N.T., QLD.",,P1 - Poorly known species,,,,
45095.0,Tricoryne soullierae,1,,,MWST,GERALDTON,Yandanooka,,P1 - Poorly known species,,,,
44833.0,Tricoryne sp. Bimbijy (G.J. Keighery & N. Gibson 7108),2,,,WHTB,CENTRAL WHEATBELT,"Bimbijy, Beacon, Elabbin, Colreavy",,P2 - Poorly known species,,,,
29476.0,Tricoryne sp. Geraldton (G.J. Keighery 10461),1,,,MWST,GERALDTON,"Mullewa, Indarra",,P1 - Poorly known species,,,,
29458.0,Tricoryne sp. Wongan Hills (B.H. Smith 794),2,,,"MWST,WHTB","MOORA,GERALDTON,CENTRAL WHEATBELT","Yandanooka Hill, Wongan Hills, Depot Hill, Mingenew",,P2 - Poorly known species,,,,
50555.0,Tricostularia davisii,3,,,"MWST,WHTB","MOORA,GREAT SOUTHERN","Manypeaks, Cape Riche, Ravensthorpe, Lake King",,P3 - Poorly known species,,,,
50556.0,Tricostularia drummondii,3,,,SCST,ALBANY,"Perth to Arthur River, 3 pops with mining tenements, 4 pops in conservation areas",,P3 - Poorly known species,,,,
50558.0,Tricostularia lepschii,2,,,WHTB,GREAT SOUTHERN,"Dragon Rocks NR, Pallarup NR and Lake Ace NR",,P2 - Poorly known species,,,,
50560.0,Tricostularia sandifordiana,3,,,SCST,ALBANY,"Between Albany and Stirling Ranges, Phillips Brook NR, Stirling Range NP",,P3 - Poorly known species,,,,
50575.0,"Tricostularia sp. Mogumber (A. Harris s.n., 23/12/2015) PN",2,,,"MWST,WHTB","MOORA,CENTRAL WHEATBELT","Mogumber, Lesueur NP",,P2 - Poorly known species,,,,
50562.0,Tricostularia sp. Porongurup (I. Abbott 18) PN,1,,,SCST,ALBANY,South Porongorups,,P1 - Poorly known species,,,,
50563.0,Tricostularia sp. Two Peoples Bay (G. Wardell-Johnson GWJ 114) PN,2,,,SCST,ALBANY,"E of Albany, Bremer Bay",,P2 - Poorly known species,,,,
19038.0,Triglochin protuberans,3,,,"GOLD,MWST,SCST","KALGOORLIE,ALBANY,MOORA,GERALDTON","Stirling Range NP, Malcolm, Yalgoo, Burnerbinmah Stn, Arrowsmith",,P3 - Poorly known species,,,,
25876.0,Triglochin sp. Condingup (R. Davis 10877),2,,,SCST,ESPERANCE,"Recherche Archipelago N.R., Dundas, Condinup",,P2 - Poorly known species,,,,
17888.0,Triodia acutispicula,3,,,KIMB,"EAST KIMBERLEY,WEST KIMBERLEY","Drysdale River, Cape Leveque, Derby, Prince Regent River, Beverley Springs Stn, Mitchell Plateau",,P3 - Poorly known species,,,,
17887.0,Triodia aeria,4,,,KIMB,WEST KIMBERLEY,Mt House Stn.,,P4 - Poorly known species,,,,
38504.0,Triodia barbata,1,,,KIMB,EAST KIMBERLEY,Ragged Range,,P1 - Poorly known species,,,,
45769.0,Triodia basitricha,3,,,PILB,KARRATHA,"Tom Price, Pannawonica, Barlee Range N.R.",,P3 - Poorly known species,,,,
48469.0,Triodia birriliburu,3,,,PILB,KARRATHA,Little Sandy Desert,,P3 - Poorly known species,,,,
17885.0,Triodia bromoides,4,,,MWST,"GERALDTON,SHARK BAY","Shark Bay, (Murchison River), Kalbarri",,P4 - Poorly known species,,,,
17884.0,Triodia bunglensis,2,,,KIMB,EAST KIMBERLEY,Bungle Bungle N.P.,,P2 - Poorly known species,,,,
45770.0,Triodia celsa,2,,,KIMB,EAST KIMBERLEY,Price Regent N.P.,,P2 - Poorly known species,,,,
48468.0,Triodia chichesterensis,3,,,PILB,KARRATHA,"Indeee Stn., Abydos",,P3 - Poorly known species,,,,
38503.0,Triodia cremnophila,1,,,KIMB,EAST KIMBERLEY,Ragged Range,,P1 - Poorly known species,,,,
