taxonId,scientificName,sourceStatus,wa rank,epbc status,dbca region,dbca district,verbatimLocality,taxonRemarks,status,vernacularName,class,wa listing note,sensitivityZoneId
50593.0,Abildgaardia pachyptera,1,,,KIMB,EAST KIMBERLEY,Mitchell Plateau,,P1 - Poorly known species,,,,
14112.0,Abutilon sp. Hamelin (A.M. Ashby 2196),2,,,MWST,SHARK BAY,"Shark Bay, Hamelin Pool, Yaringa Stn",,P2 - Poorly known species,,,,
14110.0,Abutilon sp. Onslow (F. Smith s.n. 10/9/61),3,,,PILB,KARRATHA,"Onslow, Yaraloola Stn",,P3 - Poorly known species,,,,
43021.0,Abutilon sp. Pritzelianum (S. van Leeuwen 5095),3,,,"MWST,PILB","KARRATHA,GERALDTON","Carnarvon, Port Headland, Lake McLeod, Gascoyne Junction, Mardathuna Stn., Onslow,",,P3 - Poorly known species,,,,
14114.0,Abutilon sp. Quobba (H. Demarz 3858),2,,,"MWST,PILB","EXMOUTH,GERALDTON,SHARK BAY","Quobba, Cape Range, Muggon Stn., Canarvon, Dorre Is., Gascoyne Junction",,P2 - Poorly known species,,,,
14155.0,Abutilon sp. Warburton (A.S. George 8164),1,,,GOLD,KALGOORLIE,Warburton,,P1 - Poorly known species,,,,
14044.0,Acacia adinophylla,1,,,GOLD,KALGOORLIE,Helena and Aurora Range,,P1 - Poorly known species,,,,
44442.0,Acacia adjutrices,3,,,WHTB,GREAT SOUTHERN,"Brookton, Pingelly, Tutanning, Darkin Swamp",,P3 - Poorly known species,,,,
16110.0,Acacia alata var. platyptera,4,,,"MWST,SWAN,WHTB","MOORA,PERTH HILLS,GREAT SOUTHERN","Mogumber, New Norcia, Wandoo CP, Brookton, Tutanning",,P4 - Poorly known species,,,,
13074.0,Acacia alexandri,3,,,PILB,EXMOUTH,"Cape Range, Exmouth",,P3 - Poorly known species,,,,
14046.0,Acacia ampliata,1,,,MWST,GERALDTON,"Mullewa, Coolcalalaya",,P1 - Poorly known species,,,,
14047.0,Acacia amyctica,2,,,SCST,ESPERANCE,"Peak Charles NP, Salmon Gums",,P2 - Poorly known species,,,,
3210.0,Acacia anarthros,3,,,"MWST,SWAN,WHTB","MOORA,PERTH HILLS,GREAT SOUTHERN","East of Wannamal, Hay Flat NR, Calingiri, Yerecoin, Lake Mears, Pingelly",,P3 - Poorly known species,,,,
43557.0,Acacia anastomosa,1,,,KIMB,EAST KIMBERLEY,Carson River Stn.,,P1 - Poorly known species,,,,
14585.0,Acacia ancistrophylla var. lissophylla,2,,,"SCST,WHTB","ESPERANCE,GREAT SOUTHERN,CENTRAL WHEATBELT","Kalannie, Lake Grace, Dundas N.R., S.A., Vic.",,P2 - Poorly known species,,,,
14048.0,Acacia ancistrophylla var. perarcuata,3,,,"SCST,WHTB","ESPERANCE,GREAT SOUTHERN,CENTRAL WHEATBELT","Bruce Rock, Carrabin, Mukinbudin, Korbel, Dundas, Mt Andrew,Nungarin, Westonia, Merredin",,P3 - Poorly known species,,,,
3219.0,Acacia anomala,T,VU,VU,SWAN,"PERTH HILLS,SWAN COASTAL","Darling Scarp, Bullsbrook, Muchea, Pickering Brook, Kalamunda, Bickley, Chittering",,Threatened Flora,,,,
43580.0,Acacia anserina,2,,,KIMB,EAST KIMBERLEY,Prince Regent NP,,P2 - Poorly known species,,,,
13073.0,Acacia aphanoclada,1,,,PILB,KARRATHA,Nullagine,,P1 - Poorly known species,,,,
3220.0,Acacia aphylla,T,VU,VU,"SWAN,WHTB","PERTH HILLS,CENTRAL WHEATBELT",Perth - Northam,,Threatened Flora,,,,
14049.0,Acacia aprica,T,CR,EN,MWST,MOORA,Carnamah - Coorow,,Threatened Flora,,,,
14050.0,Acacia arcuatilis,2,,,"SCST,WHTB","ALBANY,GREAT SOUTHERN","Camel Peaks, Kulin, Jitarning, Bendering, Pallarup River",,P2 - Poorly known species,,,,
3221.0,Acacia argutifolia,4,,,SCST,ALBANY,S of Ravensthorpe,,P4 - Poorly known species,,,,
14051.0,Acacia aristulata,T,EN,EN,MWST,MOORA,"Moora, Jingemia Hill",,Threatened Flora,,,,
12248.0,Acacia ascendens,2,,,WHTB,CENTRAL WHEATBELT,Chiddarcooping Hill,,P2 - Poorly known species,,,,
14052.0,Acacia asepala,2,,,"SCST,WHTB","ESPERANCE,CENTRAL WHEATBELT","Frank Hann NP, Marvel Loch, Lake Cronin, Forrestiana",,P2 - Poorly known species,,,,
14725.0,Acacia ataxiphylla subsp. ataxiphylla,3,,,"SCST,WHTB","ALBANY,GREAT SOUTHERN","Albany, Cranbrook, Jingalup, Kojonup, Chillerup, Bokal",,P3 - Poorly known species,,,,
14687.0,Acacia ataxiphylla subsp. magna,T,EN,EN,WHTB,CENTRAL WHEATBELT,"Charles Gardner Reserve, Cunderdin",,Threatened Flora,,,,
19507.0,Acacia atopa,3,,,MWST,GERALDTON,"Winderie, Dalgety Downs, Kennedy Range, Dairy Creek",,P3 - Poorly known species,,,,
14053.0,Acacia auratiflora,T,VU,EN,WHTB,GREAT SOUTHERN,"Newdegate, Lake Grace",,Threatened Flora,,,,
3230.0,Acacia auricoma,3,,,GOLD,KALGOORLIE,"Anne Range, Northern Territory",,P3 - Poorly known species,,,,
14054.0,Acacia auripila,2,,,PILB,KARRATHA,Rudall River,,P2 - Poorly known species,,,,
12249.0,Acacia awestoniana,T,CR,VU,SCST,ALBANY,Stirling Range N.P.,,Threatened Flora,,,,
31784.0,Acacia barrettiorum,2,,,KIMB,EAST KIMBERLEY,Prince Regent Nature Reserve,,P2 - Poorly known species,,,,
41461.0,Acacia bartlei,3,,,SCST,ESPERANCE,"Scaddan, Mt Burdett",,P3 - Poorly known species,,,,
3237.0,Acacia benthamii,2,,,SWAN,SWAN COASTAL,"Wanneroo, Kings Park, Stake Hill",,P2 - Poorly known species,,,,
44472.0,Acacia besleyi,1,,,SCST,ALBANY,Ravensthorpe Range,,P1 - Poorly known species,,,,
14611.0,Acacia bifaria,3,,,SCST,ALBANY,"Ravensthorpe, Fitzgerald",,P3 - Poorly known species,,,,
3243.0,Acacia botrydion,4,,,WHTB,CENTRAL WHEATBELT,Wongan Hills,,P4 - Poorly known species,,,,
13509.0,Acacia brachyphylla var. recurvata,3,,,"SCST,WHTB","ALBANY,GREAT SOUTHERN","Jerramungup, Nyabing, Kukerin, Pingrup, Highbury",,P3 - Poorly known species,,,,
12250.0,Acacia brachypoda,T,VU,EN,"SWAN,WHTB","PERTH HILLS,GREAT SOUTHERN","Brookton, Beverley, Darkin Swamp",,Threatened Flora,,,,
29571.0,Acacia bromilowiana,4,,,PILB,KARRATHA,"Tom Price, Balfour Downs Stn, West Angelas, Hope Downs, Hamersley Ranges, Marillana Stn, Ophthalmia Range",,P4 - Poorly known species,,,,
11655.0,Acacia browniana var. glaucescens,2,,,"MWST,SWAN","MOORA,PERTH HILLS","Bindoon, Julimar, Mogumber",,P2 - Poorly known species,,,,
31072.0,Acacia burrowsiana,3,,,"GOLD,MWST","KALGOORLIE,GERALDTON","Mt Magnet, Lake Mason, Cue, Sanstone, Lorna Glen Stn.",,P3 - Poorly known species,,,,
12251.0,Acacia caesariata,T,VU,,WHTB,"GREAT SOUTHERN,CENTRAL WHEATBELT","Wyalkatchem, Lake Grace, Corrigin",,Threatened Flora,,,,
3250.0,Acacia calcicola,4,,,GOLD,KALGOORLIE,"Blackstone Rg, Morgan Rg,NT",,P4 - Poorly known species,,,,
43556.0,Acacia camptocarpa,1,,,KIMB,EAST KIMBERLEY,Lake Argyle,,P1 - Poorly known species,,,,
3252.0,Acacia campylophylla,3,,,"SWAN,WHTB","PERTH HILLS,GREAT SOUTHERN,CENTRAL WHEATBELT","York, Northam, Tammin, Wyalkatchem, Dowerin, Quairading, Pantapin, Meckering",,P3 - Poorly known species,,,,
16115.0,Acacia capillaris,2,,,KIMB,"EAST KIMBERLEY,WEST KIMBERLEY","Marion Downs Stn., King Leopold Ranges",,P2 - Poorly known species,,,,
14055.0,Acacia carens,2,,,MWST,MOORA,"Eneabba, Cockleshell Gully, Gairdner Range",,P2 - Poorly known species,,,,
14058.0,Acacia cerastes,1,,,MWST,GERALDTON,"Mt Gibson, Mt Singleton, White Wells",,P1 - Poorly known species,,,,
14059.0,Acacia chapmanii subsp. australis,T,EN,EN,"SWAN,WHTB","PERTH HILLS,CENTRAL WHEATBELT","Bolgart, Wyening",,Threatened Flora,,,,
14060.0,Acacia chapmanii subsp. chapmanii,2,,,MWST,MOORA,"Three Springs, Marchagee",,P2 - Poorly known species,,,,
43585.0,Acacia claviseta,3,,,KIMB,EAST KIMBERLEY,"Bedford Downs Station, Osmond Range, Pompeys Pillar, NT",,P3 - Poorly known species,,,,
44469.0,Acacia coatesii,1,,,GOLD,KALGOORLIE,Coolgardie,,P1 - Poorly known species,,,,
14062.0,Acacia cochlocarpa subsp. cochlocarpa,T,CR,EN,MWST,MOORA,Watheroo,,Threatened Flora,,,,
14063.0,Acacia cochlocarpa subsp. velutinosa,T,CR,CR,WHTB,CENTRAL WHEATBELT,"Manmanning, Wongan Hills, Cunderdin",,Threatened Flora,,,,
14618.0,Acacia concolorans,2,,,WHTB,CENTRAL WHEATBELT,"Marvel Loch, Parker Range, Karlgarin",,P2 - Poorly known species,,,,
14064.0,Acacia congesta subsp. cliftoniana,1,,,MWST,"MOORA,GERALDTON","Arrino, Yandanooka, Moora",,P1 - Poorly known species,,,,
14065.0,Acacia congesta subsp. wonganensis,2,,,WHTB,CENTRAL WHEATBELT,"Wongan Hills, Elphin",,P2 - Poorly known species,,,,
49085.0,Acacia corusca,1,,,PILB,KARRATHA,Shovelanna Hill,,P1 - Poorly known species,,,,
12254.0,Acacia cowaniana,2,,,WHTB,"GREAT SOUTHERN,CENTRAL WHEATBELT","Mt Caroline, Mooranoppin Rock, Jilakin Rock, (Kellerberrin)",,P2 - Poorly known species,,,,
14623.0,Acacia crenulata,3,,,"GOLD,WHTB","KALGOORLIE,CENTRAL WHEATBELT","Southern Cross, Carrabin, Bullabulling, Walyahmoning Rock, Chiddarcooping, Sandford Rocks N.R., Marvel Loch",,P3 - Poorly known species,,,,
14066.0,Acacia cummingiana,3,,,"MWST,SWAN","MOORA,PERTH HILLS","Moora, Barberton, Badgingarra, Wannamal, Dandaragan, Watheroo N.P., Boonanaring",,P3 - Poorly known species,,,,
14067.0,Acacia cuneifolia,4,,,"SWAN,SWST,WHTB","PERTH HILLS,WELLINGTON,GREAT SOUTHERN","Pony Hill, Boyagin Rock, Wandoo CP, Collie, Kojonup",,P4 - Poorly known species,,,,
44476.0,Acacia curryana,1,,,MWST,GERALDTON,"Minnie Creek Station, Williambury Station",,P1 - Poorly known species,,,,
43555.0,Acacia cyclocarpa,3,,,KIMB,EAST KIMBERLEY,Prince Regent River,,P3 - Poorly known species,,,,
14068.0,Acacia cylindrica,3,,,"GOLD,WHTB","KALGOORLIE,CENTRAL WHEATBELT","Southern Cross, Mt Correll, Kulja, Hunt Range, Kalannie, Chiddarcooping N.R., Mollerin N.R., Mt Manning Range, Ennuin Stn.",,P3 - Poorly known species,,,,
14087.0,Acacia cyperophylla var. omearana,1,,,PILB,KARRATHA,Nullagine,,P1 - Poorly known species,,,,
3286.0,Acacia daweana,3,,,PILB,KARRATHA,"Hamersley Range, Karijini N.P.",,P3 - Poorly known species,,,,
12255.0,Acacia declinata,4,,,SCST,ALBANY,"Borden, Boxwood Hill (Marra Bridge), Kalgan",,P4 - Poorly known species,,,,
3287.0,Acacia deflexa,3,,,WHTB,"GREAT SOUTHERN,CENTRAL WHEATBELT","Toolibin, Bendering, Wickepin, Wongan Hills, Corrigin",,P3 - Poorly known species,,,,
14463.0,Acacia deltoidea subsp. ampla,2,,,KIMB,EAST KIMBERLEY,"Bougainville Peninsula, Lawley River, Mitchell Falls",,P2 - Poorly known species,,,,
3293.0,Acacia denticulosa,T,VU,VU,WHTB,CENTRAL WHEATBELT,Beacon-Mt Churchman,,Threatened Flora,,,,
3295.0,Acacia depressa,T,EN,VU,WHTB,GREAT SOUTHERN,W of Lake Grace,,Threatened Flora,,,,
14069.0,Acacia desertorum var. nudipes,3,,,"GOLD,WHTB","KALGOORLIE,CENTRAL WHEATBELT","Ghooli, Southern Cross, Yellowdine, Mt Dimer",,P3 - Poorly known species,,,,
31925.0,Acacia diallaga,1,,,MWST,GERALDTON,"Karara, Warriedar",,P1 - Poorly known species,,,,
16019.0,Acacia diaphana,1,,,SCST,ESPERANCE,"Niblick Hill, Clyde Hill, Mt. Buraminya",,P1 - Poorly known species,,,,
43561.0,Acacia diastemata,3,,,KIMB,EAST KIMBERLEY,"Drysdale River N.P., Roe River, Prince Regent River N.R.",,P3 - Poorly known species,,,,
44474.0,Acacia dilloniorum,1,,,MWST,GERALDTON,Weld Range,,P1 - Poorly known species,,,,
14071.0,Acacia diminuta,1,,,SCST,"ALBANY,ESPERANCE","Scaddan, Truslove, Fitzgerald",,P1 - Poorly known species,,,,
43584.0,Acacia dimorpha,1,,,KIMB,WEST KIMBERLEY,"Edkins Range, Artesian Range",,P1 - Poorly known species,,,,
14619.0,Acacia dissona var. indoloria,3,,,"GOLD,SCST,WHTB","KALGOORLIE,ESPERANCE,GREAT SOUTHERN,CENTRAL WHEATBELT","Kulja, Bruce Rock, Muntadgin, Frank Hann N.P., Ballidu, Dragon Rocks N.R.",,P3 - Poorly known species,,,,
12256.0,Acacia dorsenna,1,,,SCST,ESPERANCE,"Norseman, Lake Cowan",,P1 - Poorly known species,,,,
3309.0,Acacia drepanophylla,3,,,MWST,"GERALDTON,SHARK BAY","Overlander, Billabong R/H, Coburn Stn, Hamelin, Yaringa. Peron Peninsula",,P3 - Poorly known species,,,,
11829.0,Acacia drewiana subsp. minor,2,,,WHTB,"GREAT SOUTHERN,CENTRAL WHEATBELT","Wongan Hills, Newdegate-Lake King, Nyabing",,P2 - Poorly known species,,,,
11229.0,Acacia drummondii subsp. affinis,3,,,"MWST,SWAN","MOORA,GERALDTON,PERTH HILLS","Bindoon, Muchea, Julimar, Wannamal, Mullewa, New Norcia, Drummond NR",,P3 - Poorly known species,,,,
14854.0,Acacia drummondii subsp. elegans Porongurup variant (R.J. Cumming 938),4,,,SCST,ALBANY,Porongurup Range,,P4 - Poorly known species,,,,
3314.0,Acacia dura,2,,,WHTB,CENTRAL WHEATBELT,"Piawaning, Wongan Hills, Elphin,Yerecoin",,P2 - Poorly known species,,,,
3316.0,Acacia effusa,3,,,PILB,KARRATHA,"Mt Bruce, Hamersley Ra., Karijini N.P., Juna Downs",,P3 - Poorly known species,,,,
3319.0,Acacia epacantha,3,,,MWST,MOORA,"Dandaragan, Badgingarra, Eneabba, Lesueur",,P3 - Poorly known species,,,,
14074.0,Acacia epedunculata,1,,,GOLD,KALGOORLIE,Caenyie Rock,,P1 - Poorly known species,,,,
16014.0,Acacia eremophila var. Numerous-nerved variant (A.S.George 11924),3,,,"GOLD,SCST","KALGOORLIE,ESPERANCE","Norseman, Neale Junction, Great Victoria Desert, Balladonia, Plumridge Lakes",,P3 - Poorly known species,,,,
16121.0,Acacia eremophila var. variabilis,3,,,"GOLD,SCST,WHTB","KALGOORLIE,ESPERANCE,CENTRAL WHEATBELT","Ardath, Comet Vale, Zanthus, Balladonia, Lake Moore",,P3 - Poorly known species,,,,
14681.0,Acacia errabunda,3,,,"SCST,WHTB","ALBANY,GREAT SOUTHERN","Ravensthorpe, Jerramungup, Broomehill",,P3 - Poorly known species,,,,
14075.0,Acacia euthyphylla,3,,,SCST,ESPERANCE,"Clyde Hill, Truslove, Mt Ney, Mt Ridley",,P3 - Poorly known species,,,,
23522.0,Acacia fecunda,1,,,PILB,KARRATHA,"Nullagine, Skull Springs, Oakover River",,P1 - Poorly known species,,,,
3337.0,Acacia filifolia,3,,,"MWST,WHTB","MOORA,CENTRAL WHEATBELT","Wongan Hills, Burracoppin, Southern Cross, Coorow, Marchagee",,P3 - Poorly known species,,,,
3338.0,Acacia flabellifolia,3,,,MWST,"MOORA,GERALDTON","Arrino, Watheroo, Eneabba",,P3 - Poorly known species,,,,
3339.0,Acacia flagelliformis,4,,,SWST,"BLACKWOOD,WELLINGTON","Harvey, Eaton, Bunbury, Capel, Busselton, Donnybrook",,P4 - Poorly known species,,,,
14076.0,Acacia formidabilis,3,,,"GOLD,MWST,WHTB","KALGOORLIE,GERALDTON,CENTRAL WHEATBELT","Wanarra, Perenjori, Paynes Find, Southern Cross, Warralackin, Bungalbin Hill",,P3 - Poorly known species,,,,
3341.0,Acacia forrestiana,T,VU,VU,MWST,MOORA,"Dandaragan, Jurien Bay",,Threatened Flora,,,,
14077.0,Acacia gelasina,2,,,MWST,GERALDTON,"Kalbarri NP, Eurardy",,P2 - Poorly known species,,,,
43160.0,Acacia gibsonii,1,,,SCST,ESPERANCE,Lake Johnson,,P1 - Poorly known species,,,,
14621.0,Acacia glaucissima,3,,,SCST,ESPERANCE,"Salmon Gums, Mt Heywood, Mt Ney, Grass Patch",,P3 - Poorly known species,,,,
14078.0,Acacia gloeotricha,1,,,KIMB,"EAST KIMBERLEY,WEST KIMBERLEY","Dimond Gorge, Fitzroy River",,P1 - Poorly known species,,,,
31032.0,Acacia graciliformis,1,,,MWST,GERALDTON,Koolanooka Hills,,P1 - Poorly known species,,,,
3357.0,Acacia grisea,4,,,"SCST,WHTB","ALBANY,GREAT SOUTHERN","Nyabing, Peringillup, Kukerin, Kojonup, Woodanilling, Wagin, Ravensthorpe",,P4 - Poorly known species,,,,
3358.0,Acacia guinetii,4,,,MWST,GERALDTON,Geraldton-Northampton,,P4 - Poorly known species,,,,
44473.0,Acacia haematites,1,,,GOLD,KALGOORLIE,Koolyanobbing Range,,P1 - Poorly known species,,,,
12760.0,Acacia heterochroa subsp. robertii,2,,,WHTB,GREAT SOUTHERN,"Bottle Rock, Varley, Digger Rock, South Ironcap",,P2 - Poorly known species,,,,
14117.0,Acacia heteroclita subsp. valida,2,,,SCST,ALBANY,Porongurup Range,,P2 - Poorly known species,,,,
3373.0,Acacia horridula,3,,,SWAN,PERTH HILLS,Helena Valley - Serpentine,,P3 - Poorly known species,,,,
17332.0,Acacia hypermeces,1,,,KIMB,EAST KIMBERLEY,"Pelican Rock Creek, Berkeley River",,P1 - Poorly known species,,,,
14617.0,Acacia hystrix subsp. continua,1,,,SCST,ESPERANCE,"Daniell Siding, Lake Johnston",,P1 - Poorly known species,,,,
14118.0,Acacia imitans,4,,EN,MWST,GERALDTON,"Mt Singleton, Mt Gibson, Ningham",,P4 - Poorly known species,,,,
14683.0,Acacia imparilis,4,,,SCST,ALBANY,"Stirling Range, Hamilla Hill",,P4 - Poorly known species,,,,
14682.0,Acacia improcera,3,,,"SCST,WHTB","ALBANY,ESPERANCE,GREAT SOUTHERN","Ravensthorpe, Frank Hann N.P., Lake King, Mount Glasse, Grass Patch, Sheoak Hill",,P3 - Poorly known species,,,,
14119.0,Acacia incanicarpa,2,,,SCST,ESPERANCE,"Mt Le Grand, Mt Merivale",,P2 - Poorly known species,,,,
18106.0,Acacia inceana subsp. latifolia,1,,,WHTB,CENTRAL WHEATBELT,"Kalannie, Jibberding",,P1 - Poorly known species,,,,
3385.0,Acacia inophloia,3,,,WHTB,"GREAT SOUTHERN,CENTRAL WHEATBELT","Pederah, Bendering, Muntadgin, Moora, Mt Bebb, Kulin, Wialcutting N.R., Bilbarin, Billericay, Narembeen",,P3 - Poorly known species,,,,
3386.0,Acacia inops,3,,,SWST,BLACKWOOD,"Margaret River, Yelverton, Witchcliffe",,P3 - Poorly known species,,,,
14121.0,Acacia insolita subsp. recurva,T,CR,EN,WHTB,GREAT SOUTHERN,"East Yornaning NR, Narrogin",,Threatened Flora,,,,
14122.0,Acacia isoneura subsp. isoneura,3,,,"MWST,WHTB","MOORA,GERALDTON,CENTRAL WHEATBELT","Mingenew, Three Springs, Caron, Buntine, Perenjori, Wubin, Eurardy",,P3 - Poorly known species,,,,
14123.0,Acacia isoneura subsp. nimia,3,,,"MWST,WHTB","MOORA,GERALDTON,CENTRAL WHEATBELT","Billabong, Murchison River, Ajana, Coorow, Watheroo",,P3 - Poorly known species,,,,
13917.0,Acacia jasperensis,3,,,KIMB,EAST KIMBERLEY,"Berkeley River, Kununurra, N.T.",,P3 - Poorly known species,,,,
50702.0,Acacia karinae,1,,,MWST,GERALDTON,"Blue Hill Range, Karara, Mt Gibson Stn",,P1 - Poorly known species,,,,
44443.0,Acacia keigheryi,3,,,SCST,ALBANY,"Ongerup, Boxwood Hill, Wellstead",,P3 - Poorly known species,,,,
14124.0,Acacia kenneallyi,3,,,KIMB,EAST KIMBERLEY,Bonaparte Archipelago,,P3 - Poorly known species,,,,
3400.0,Acacia kerryana,2,,,"GOLD,SCST,WHTB","KALGOORLIE,ESPERANCE,GREAT SOUTHERN","Norseman, Jimberlana Hill, Bremer Range, Lake Cronin, Spargoville",,P2 - Poorly known species,,,,
3401.0,Acacia kimberleyensis,2,,,KIMB,EAST KIMBERLEY,"Packhorse Range, Mt Agnes, Prince Regent River",,P2 - Poorly known species,,,,
3402.0,Acacia kingiana,X,EX,EX,WHTB,GREAT SOUTHERN,Wagin,,Presumed Extinct,,,,
44493.0,Acacia kulinensis,1,,,WHTB,GREAT SOUTHERN,Kulin,,P1 - Poorly known species,,,,
50095.0,Acacia lachnocarpa,1,,,WHTB,GREAT SOUTHERN,Mt Holland,,P1 - Poorly known species,,,,
12259.0,Acacia lanceolata,3,,,MWST,"MOORA,GERALDTON","Three Springs, Mingenew",,P3 - Poorly known species,,,,
12260.0,Acacia lanei,3,,,WHTB,GREAT SOUTHERN,"Hyden, Pederah",,P3 - Poorly known species,,,,
12261.0,Acacia lanuginophylla,T,VU,EN,WHTB,"GREAT SOUTHERN,CENTRAL WHEATBELT",Newdegate-Pingaring,,Threatened Flora,,,,
44482.0,Acacia lapidosa,1,,,MWST,GERALDTON,"Mount Magnet, Paynesville",,P1 - Poorly known species,,,,
14932.0,Acacia lasiocarpa var. bracteolata long peduncle variant (G.J. Keighery 5026),1,,,SWAN,"PERTH HILLS,SWAN COASTAL","North Dandalup, Mundijong, Gosnells, Jandakot, Serpentine, Mundijong",,P1 - Poorly known species,,,,
14931.0,Acacia lasiocarpa var. lasiocarpa Cockleshell Gully variant (E.A. Griffin 2039),2,,,MWST,MOORA,"Cockleshell Gully, Lesueur NP",,P2 - Poorly known species,,,,
14930.0,Acacia lateriticola var. Glabrous variant (B.R.Maslin 6765),3,,,SWST,BLACKWOOD,"Dunsborough, Scott River, Margaret River, Quindalup",,P3 - Poorly known species,,,,
14612.0,Acacia latipes subsp. licina,3,,,MWST,"MOORA,GERALDTON","Erangy Springs, Geraldton, Three Springs, Northampton, Hutt River, Eneabba",,P3 - Poorly known species,,,,
23523.0,Acacia leeuweniana,1,,,PILB,KARRATHA,"Spear Hill, Wodgina",,P1 - Poorly known species,,,,
14929.0,Acacia leioderma var. Fitzgerald River N.P. variant (A.S.George 9922),2,,,SCST,ALBANY,"Fitzgerald River NP, Gordon Inlet",,P2 - Poorly known species,,,,
3414.0,Acacia lentiginea,2,,,KIMB,EAST KIMBERLEY,"Mitchell Plateau, Prince Regent N.R.",,P2 - Poorly known species,,,,
13610.0,Acacia leptalea,T,VU,EN,WHTB,GREAT SOUTHERN,"Nyabing, Chinocup",,Threatened Flora,,,,
16131.0,Acacia leptocarpa,1,,,KIMB,EAST KIMBERLEY,Carlton Hill Stn.,,P1 - Poorly known species,,,,
3415.0,Acacia leptoneura,T,CR,CR,WHTB,CENTRAL WHEATBELT,Dowerin,,Threatened Flora,,,,
11375.0,Acacia leptospermoides subsp. obovata,2,,,MWST,GERALDTON,"Kalbarri NP, Murchison River",,P2 - Poorly known species,,,,
11330.0,Acacia leptospermoides subsp. psammophila,3,,,MWST,GERALDTON,"Geraldton, Yuna, Indarra, Eradu",,P3 - Poorly known species,,,,
15289.0,Acacia levata,3,,,PILB,KARRATHA,"Marble Bar, Woodstock H/S, Hillside",,P3 - Poorly known species,,,,
12262.0,Acacia lineolata subsp. multilineata,1,,,MWST,"MOORA,GERALDTON","Arrino, Mullewa, Yuna, Latham, Mingenew",,P1 - Poorly known species,,,,
16977.0,Acacia lirellata subsp. compressa,2,,,WHTB,CENTRAL WHEATBELT,"Ballidu, Bruce Rock, Holleton, Muntadgin",,P2 - Poorly known species,,,,
16978.0,Acacia lirellata subsp. lirellata,3,,,"MWST,SWAN,WHTB","MOORA,PERTH HILLS,CENTRAL WHEATBELT","Coorow, Watheroo, Northam, Quairading, Tammin, Meckering",,P3 - Poorly known species,,,,
12263.0,Acacia lobulata,T,EN,EN,WHTB,CENTRAL WHEATBELT,Warralakkin,,Threatened Flora,,,,
44481.0,Acacia mackenziei,1,,,KIMB,EAST KIMBERLEY,Thompson Spring,,P1 - Poorly known species,,,,
14753.0,Acacia manipularis,1,,,KIMB,"EAST KIMBERLEY,WEST KIMBERLEY","Mt House Stn, Tableland Stn",,P1 - Poorly known species,,,,
3437.0,Acacia megacephala,3,,,MWST,GERALDTON,"E of Geraldton, Kojarena, Burma Road",,P3 - Poorly known species,,,,
3441.0,Acacia merrickiae,4,,,WHTB,CENTRAL WHEATBELT,"Kellerberrin, Bungulla, Mukinbudin, Yelbeni",,P4 - Poorly known species,,,,
3444.0,Acacia microneura,1,,,"SCST,WHTB","ALBANY,GREAT SOUTHERN","Cranbrook, Pallinup River (Mailalup)",,P1 - Poorly known species,,,,
19176.0,Acacia mitodes,2,,,KIMB,EAST KIMBERLEY,Drysdale River N.P.,,P2 - Poorly known species,,,,
42183.0,Acacia monticola x tumida var. kulparn,3,,,KIMB,WEST KIMBERLEY,"Broome, James Price Point, Perpendicular Head, Derby, Kimberley Downs Stn., Bina Stn.",,P3 - Poorly known species,,,,
31033.0,Acacia muriculata,1,,,MWST,GERALDTON,Koolanooka Hills,,P1 - Poorly known species,,,,
14125.0,Acacia mutabilis subsp. incurva,2,,,"SCST,WHTB","ALBANY,GREAT SOUTHERN","Ongerup, Pingrup, Needilup",,P2 - Poorly known species,,,,
14126.0,Acacia mutabilis subsp. rhynchophylla,3,,,WHTB,GREAT SOUTHERN,"Pingrup, Nyabing, Borden",,P3 - Poorly known species,,,,
14127.0,Acacia mutabilis subsp. stipulifera,3,,,"SCST,WHTB","ALBANY,GREAT SOUTHERN","Lake Cobham, Lake Bryde, Lake Magenta, Needilup",,P3 - Poorly known species,,,,
3456.0,Acacia newbeyi,3,,,"SCST,WHTB","ALBANY,GREAT SOUTHERN","Nyabing, Boxwood Hills, Ravensthorpe, Ongerup, Dragon Rocks",,P3 - Poorly known species,,,,
14685.0,Acacia nigripilosa subsp. latifolia,1,,,MWST,GERALDTON,"Maya, Latham, Caron, Bunjil",,P1 - Poorly known species,,,,
3459.0,Acacia nitidula,3,,,SCST,"ALBANY,ESPERANCE","Recherche Archipelago, Cape Arid, condingup, Jerramungup, Ravensthorpe",,P3 - Poorly known species,,,,
3460.0,Acacia nodiflora,3,,,MWST,"MOORA,GERALDTON",Carnamah,,P3 - Poorly known species,,,,
14128.0,Acacia obesa,3,,,WHTB,GREAT SOUTHERN,"Hyden, Lake King, Lake Grace",,P3 - Poorly known species,,,,
43558.0,Acacia obtriangularis,1,,,KIMB,EAST KIMBERLEY,Lawley River,,P1 - Poorly known species,,,,
14129.0,Acacia oncinophylla subsp. oncinophylla,3,,,"MWST,SWAN,WARR","MOORA,DONNELLY,PERTH HILLS","Mogumber, Mundaring, John Forrest NP, Serpentine, Mt Lennard, Dwellingup, Winnejup",,P3 - Poorly known species,,,,
14131.0,Acacia oncinophylla subsp. patulifolia,4,,,"SWAN,SWST,WARR","DONNELLY,PERTH HILLS,SWAN COASTAL,WELLINGTON","Gosnells, North Dandalup, Wagerup, Winnejup",,P4 - Poorly known species,,,,
43583.0,Acacia orthotropica,2,,,KIMB,EAST KIMBERLEY,Prince Regent National Park,,P2 - Poorly known species,,,,
14133.0,Acacia papulosa,2,,,SCST,ALBANY,"Boxwood Hill, Fitzgerald River",,P2 - Poorly known species,,,,
44477.0,Acacia parkerae,3,,,"SWST,WARR,WHTB","BLACKWOOD,DONNELLY,GREAT SOUTHERN","Frankland, Kojonup, Greenbushes",,P3 - Poorly known species,,,,
12266.0,Acacia paula,1,,,KIMB,EAST KIMBERLEY,Mitchell Plateau,,P1 - Poorly known species,,,,
14134.0,Acacia pelophila,1,,,MWST,GERALDTON,"Northampton, Lynton",,P1 - Poorly known species,,,,
43581.0,Acacia perpusilla,1,,,KIMB,EAST KIMBERLEY,Theda Stn.,,P1 - Poorly known species,,,,
44483.0,Acacia petricola,2,,,MWST,GERALDTON,Mount Augustus,,P2 - Poorly known species,,,,
43560.0,Acacia phacelia,3,,,KIMB,WEST KIMBERLEY,"Edkins Range, Harding Range, Sprigg River",,P3 - Poorly known species,,,,
3486.0,Acacia phaeocalyx,3,,,WHTB,"GREAT SOUTHERN,CENTRAL WHEATBELT","Kellerberrin, Wongan Hills, Tammin, Quairading, Lomos, Dowerin, Cunderdin",,P3 - Poorly known species,,,,
3487.0,Acacia pharangites,T,CR,EN,WHTB,CENTRAL WHEATBELT,Wongan Hills,,Threatened Flora,,,,
14162.0,Acacia phlebopetala var. pubescens,2,,,SCST,ALBANY,Whoogarup Range,,P2 - Poorly known species,,,,
14136.0,Acacia plautella,3,,,MWST,GERALDTON,"Ajana, Wannoo Roadhouse, Murchison, Eurardy Station, Kalbarri NP, Cooloomia NR",,P3 - Poorly known species,,,,
3493.0,Acacia plicata,3,,,MWST,MOORA,"Hill River, Cataby, Lesueur",,P3 - Poorly known species,,,,
3497.0,Acacia prismifolia,T,CR,EX,SCST,ALBANY,"Albany, Stirling Range N.P.",,Threatened Flora,,,,
14607.0,Acacia pterocaulon,1,,,MWST,GERALDTON,Morawa,,P1 - Poorly known species,,,,
14927.0,Acacia pulchella var. reflexa acuminate bracteole variant (R.J. Cumming 882),3,,,SWAN,PERTH HILLS,"Wannamal, Bindoon, York, Boonanarring",,P3 - Poorly known species,,,,
13611.0,Acacia pygmaea,T,EN,EN,WHTB,CENTRAL WHEATBELT,Wongan Hills,,Threatened Flora,,,,
14400.0,Acacia recurvata,T,VU,EN,MWST,MOORA,"Davies Breakaway, Three Springs, Winchester",,Threatened Flora,,,,
14139.0,Acacia repanda,3,,,WHTB,"GREAT SOUTHERN,CENTRAL WHEATBELT","Lake Hurlstone, Lake Carmody, Wongan Hills, The Basin, Varley",,P3 - Poorly known species,,,,
16144.0,Acacia repens,1,,,KIMB,EAST KIMBERLEY,Carr Boyd Range,,P1 - Poorly known species,,,,
3518.0,Acacia retrorsa,2,,,MWST,MOORA,Mt Lesueur area,,P2 - Poorly known species,,,,
14140.0,Acacia rhamphophylla,T,CR,EN,SCST,ALBANY,Kundip,,Threatened Flora,,,,
3520.0,Acacia richardsii,3,,,KIMB,EAST KIMBERLEY,"Kununurra, Keep River N.P., Northern Carr Boyd Ranges, Gardner Plateau, N.T.",,P3 - Poorly known species,,,,
3521.0,Acacia ridleyana,3,,,MWST,"MOORA,GERALDTON","Northampton, Gregory, Murchison River, Mogumber",,P3 - Poorly known species,,,,
13071.0,Acacia ryaniana,2,,,"MWST,PILB","EXMOUTH,GERALDTON","Cape Cuvier, Quobba, Coral Bay, Cape Range N.P.",,P2 - Poorly known species,,,,
14644.0,Acacia scalena,3,,,"MWST,WHTB","GERALDTON,CENTRAL WHEATBELT","Wubin, Buntine Reserve, Nugadong, Ballidu, Latham, Maya, Petruder Rocks",,P3 - Poorly known species,,,,
3531.0,Acacia sciophanes,T,CR,EN,WHTB,CENTRAL WHEATBELT,"Mukinbudin, Victoria Rock",,Threatened Flora,,,,
