taxonId,scientificName,sourceStatus,wa rank,epbc status,dbca region,dbca district,verbatimLocality,taxonRemarks,status,vernacularName,class,wa listing note,sensitivityZoneId
30438.0,Lepidosperma sp. Parker Range (N. Gibson & M. Lyons 2094),1,,,WHTB,CENTRAL WHEATBELT,Parker Range,,P1 - Poorly known species,,,,
29138.0,Lepidosperma sp. Pigeon Rocks (H. Pringle 30237),3,,,"GOLD,WHTB","KALGOORLIE,GREAT SOUTHERN,CENTRAL WHEATBELT","Pigeon Rocks, Moorine Rocks, Dragon Rocks N.R.",,P3 - Poorly known species,,,,
34436.0,Lepidosperma sp. Shoemaker Levy (L. Ang & O. Davies 10815),3,,,SCST,ALBANY,"Ravensthorpe Range, Bandalup Hill, Fitzgerald River N.P., Kundip N.R.",,P3 - Poorly known species,,,,
33176.0,"Lepidosperma sp. Steere River (S. Kern, R. Jasper, H. Hughes LCH 17764)",4,,,SCST,ALBANY,"Racensthorpe Range, Bandalup Hill, Fitgerald River NP, Kundip",,P4 - Poorly known species,,,,
8100.0,Leptinella drummondii,3,,,"SWST,WARR","BLACKWOOD,DONNELLY,FRANKLAND","Frankland River, Tone River, Blackwood River",,P3 - Poorly known species,,,,
2343.0,Leptomeria dielsiana,X,EX,VU,SWST,BLACKWOOD,Scott River,,Presumed Extinct,,,,
17702.0,Leptomeria furtiva,2,,,SWST,BLACKWOOD,"Cowaramup, Scott River, Ambergate, Busselton",,P2 - Poorly known species,,,,
12689.0,Leptospermum confertum,2,,,SCST,ALBANY,East Mt Barren,,P2 - Poorly known species,,,,
12690.0,Leptospermum exsertum,1,,,MWST,GERALDTON,"Tardun, Mullewa, Perenjori, Bowgada",,P1 - Poorly known species,,,,
12687.0,Leptospermum macgillivrayi,3,,,GOLD,KALGOORLIE,"Mt Jackson, Diemals",,P3 - Poorly known species,,,,
13347.0,Leptospermum madidum subsp. sativum,3,,,KIMB,EAST KIMBERLEY,"Osmond Range, Purnululu N.P., Bedford Downs Stn., Prince Regent N.R.",,P3 - Poorly known species,,,,
23998.0,Lepturus copeanus,1,,,KIMB,EAST KIMBERLEY,Weaber Plain,,P1 - Poorly known species,,,,
473.0,Lepturus repens,3,,,KIMB,"EAST KIMBERLEY,WEST KIMBERLEY","Ashmore Reef, Cassine Is., High Cliffy Is.",,P3 - Poorly known species,,,,
474.0,Lepturus xerophilus,1,,,KIMB,EAST KIMBERLEY,Carlton Hill Stn.,,P1 - Poorly known species,,,,
19241.0,Lepyrodia curvescens,2,,,"MWST,SWAN","MOORA,SWAN COASTAL","Hazelmere, Regans Ford, Mt Lesueur, Jurien",,P2 - Poorly known species,,,,
17954.0,Lepyrodia extensa,2,,,"SWST,WARR","BLACKWOOD,DONNELLY,FRANKLAND","Augusta, Denmark, Mt Frankland N.P, Kodjinup",,P2 - Poorly known species,,,,
13777.0,Lepyrodia fortunata,2,,,SCST,ESPERANCE,Cape Le Grande N.P.,,P2 - Poorly known species,,,,
1086.0,Lepyrodia heleocharoides,3,,,"SWAN,SWST,WARR","BLACKWOOD,FRANKLAND,PERTH HILLS","Alexander Bridge, Scott River, Chester Block, (Parkerville),Mt Lindesay",,P3 - Poorly known species,,,,
6353.0,Leucopogon acicularis,2,,,SCST,ALBANY,Stirling Range NP,,P2 - Poorly known species,,,,
6355.0,Leucopogon alternifolius,3,,,"SCST,WARR","ALBANY,FRANKLAND","Cape Howe, Albany, Marbellup, Mt Frankland NP, Walpole-Nornalup NP",,P3 - Poorly known species,,,,
33379.0,Leucopogon altissimus,3,,,SCST,ALBANY,"Waychinicup, Mt Manypeaks, Two Peoples Bay NR",,P3 - Poorly known species,,,,
6356.0,Leucopogon amplectens,2,,,WHTB,CENTRAL WHEATBELT,"Tammin, North of Kellerberrin",,P2 - Poorly known species,,,,
6357.0,Leucopogon apiculatus,3,,,SCST,ESPERANCE,"Cape Le Grand, Pt Malcolm, Middle Island, Wharton, Sandy Hook Island, Cape Arid",,P3 - Poorly known species,,,,
44220.0,Leucopogon audax,2,,,WHTB,GREAT SOUTHERN,"Tutanning, Weam, Pingelly, Popanyinning",,P2 - Poorly known species,,,,
31794.0,Leucopogon borealis,2,,,MWST,GERALDTON,"Northampton, Howatharra",,P2 - Poorly known species,,,,
6362.0,Leucopogon bossiaea,2,,,SCST,ESPERANCE,Israelite Bay,,P2 - Poorly known species,,,,
6363.0,Leucopogon bracteolaris,2,,,SCST,ALBANY,"Stirling Range N.P., Albany",,P2 - Poorly known species,,,,
6371.0,Leucopogon compactus,4,,,SCST,ALBANY,"Cape Arid,  Fitzgerald River N.P., East Mt Barren",,P4 - Poorly known species,,,,
44222.0,Leucopogon corymbiformis,2,,,SCST,ESPERANCE,"Esperance, Cape Arid N.P.",,P2 - Poorly known species,,,,
6381.0,Leucopogon cryptanthus,X,EX,EX,UKN,Unknown,South-west Western Australia,,Presumed Extinct,,,,
44224.0,Leucopogon darlingensis subsp. rectus,2,,,WHTB,GREAT SOUTHERN,"Williams, Dryandra, Highbury",,P2 - Poorly known species,,,,
35501.0,Leucopogon elegans subsp. psorophyllus,3,,,SCST,ALBANY,"Wellstead, Cape Riche,",,P3 - Poorly known species,,,,
41160.0,Leucopogon extremus,2,,,SWST,WELLINGTON,Collie,,P2 - Poorly known species,,,,
6393.0,Leucopogon florulentus,3,,,"SCST,SWAN,WHTB","ALBANY,ESPERANCE,PERTH HILLS,GREAT SOUTHERN","Ongerup, Esperance, Cordering, Wagin, Bannister, Jerramungup, Lake Magenta Nature Reserve",,P3 - Poorly known species,,,,
48179.0,Leucopogon foliosus,3,,,MWST,MOORA,"Mt Lesueur, Coomallo N.R., Badgingarra, Cataby",,P3 - Poorly known species,,,,
6398.0,Leucopogon gnaphalioides,T,CR,EN,SCST,ALBANY,Stirling Range,,Threatened Flora,,,,
48180.0,Leucopogon grammatus,3,,,MWST,MOORA,"Eneabba, Burma Road, Allanooka",,P3 - Poorly known species,,,,
45055.0,Leucopogon incisus,2,,,SWST,BLACKWOOD,Blackwood River N.P.,,P2 - Poorly known species,,,,
6406.0,Leucopogon interruptus,3,,,SCST,ESPERANCE,"Cape Le Grand NP, Cape Arid NP, Recherche Archipelago NR, Merivale",,P3 - Poorly known species,,,,
49922.0,Leucopogon kirupensis,2,,,SWST,BLACKWOOD,Kirup,,P2 - Poorly known species,,,,
6408.0,Leucopogon lasiophyllus,4,,,SCST,ALBANY,"Mt Barker, Stirling Range N.P.",,P4 - Poorly known species,,,,
40801.0,Leucopogon maritimus,1,,,SWAN,SWAN COASTAL,"Burns Beach, Yanchep, Two Rocks",,P1 - Poorly known species,,,,
41352.0,Leucopogon navicularis,1,,,MWST,GERALDTON,Dongara,,P1 - Poorly known species,,,,
41261.0,Leucopogon newbeyi,3,,,"SCST,WHTB","ALBANY,GREAT SOUTHERN","Nyabing, Ongerup",,P3 - Poorly known species,,,,
40802.0,Leucopogon nitidus,T,EN,EN,MWST,GERALDTON,Geraldton,,Threatened Flora,,,,
6426.0,Leucopogon ozothamnoides,1,,,WHTB,GREAT SOUTHERN,"Kojonup, Arthur River",,P1 - Poorly known species,,,,
6432.0,Leucopogon plumuliflorus,2,,,MWST,MOORA,"Gairdner Range, Mt Lesueur",,P2 - Poorly known species,,,,
6437.0,Leucopogon psammophilus,1,,,MWST,GERALDTON,"Burma Road, Port Gregory",,P1 - Poorly known species,,,,
34769.0,Leucopogon remotus,1,,,SCST,ESPERANCE,N of Bonnie Hill,,P1 - Poorly known species,,,,
34770.0,Leucopogon rugulosus,1,,,SCST,ESPERANCE,"NW of Roberts Swamp, Mt Beaumont, Sth of Peak Charles",,P1 - Poorly known species,,,,
20084.0,Leucopogon sp. Brookton (K. Kershaw & L. Kerrigan KK 2192),1,,,WHTB,GREAT SOUTHERN,Brookton,,P1 - Poorly known species,,,,
29492.0,Leucopogon sp. Busselton (D. Cooper 243),2,,,SWST,BLACKWOOD,"Capel, Ruabon N.R., Dardanup",,P2 - Poorly known species,,,,
49053.0,Leucopogon sp. Cascades (M. Hislop 3693),1,,,SCST,ESPERANCE,Munglinup,,P1 - Poorly known species,,,,
20365.0,Leucopogon sp. Howatharra (D. & N. McFarland 1046),2,,,MWST,GERALDTON,Moresby Ranges,,P2 - Poorly known species,,,,
19518.0,Leucopogon sp. Ironcaps (N. Gibson & K. Brown 3070),3,,,"SCST,WHTB","ESPERANCE,CENTRAL WHEATBELT","South Ironcap, Middle Ironcap, Hatters Hill, Frank Hann NP, Welsh NR, Holleton, Burracoppin, Wogarl, Mt Gibbs",,P3 - Poorly known species,,,,
33017.0,Leucopogon sp. Israelite Bay (G.F. Craig 2558),2,,,SCST,ESPERANCE,Israelite Bay,,P2 - Poorly known species,,,,
41769.0,Leucopogon sp. Lake Magenta (K.R. Newbey 3387),1,,,WHTB,GREAT SOUTHERN,"Newdegate, Pingrup, Lake Magenta",,P1 - Poorly known species,,,,
36058.0,Leucopogon sp. Manypeaks (A.S. George 6488),T,EN,,SCST,ALBANY,Manypeaks,,Threatened Flora,,,,
20360.0,Leucopogon sp. Moresby Range (S. Patrick 2614),3,,,MWST,GERALDTON,Moresby Ranges,,P3 - Poorly known species,,,,
30349.0,Leucopogon sp. Port Gregory (C. Page 33),1,,,MWST,GERALDTON,Yerina Springs,,P1 - Poorly known species,,,,
42440.0,Leucopogon sp. Varley (M. Hislop 3659),2,,,SCST,ESPERANCE,Frank Hann NP,,P2 - Poorly known species,,,,
19460.0,Leucopogon sp. Yanchep (M. Hislop 1986),3,,,SWAN,SWAN COASTAL,"Yanchep N.P., Gnangarra-Moore River S.F., Neerabup N.P.",,P3 - Poorly known species,,,,
14506.0,Leucopogon sp. Yanneymooning (F. Mollemans 3797),3,,,"GOLD,WHTB","KALGOORLIE,CENTRAL WHEATBELT","Mukinbudin, Mt Jackson Stn., Bonnie Rock",,P3 - Poorly known species,,,,
36059.0,Leucopogon sp. Yellowdine (M. Hislop & F. Hort MH 3194),2,,,"GOLD,SCST,WHTB","KALGOORLIE,ESPERANCE,CENTRAL WHEATBELT","N of Yellowdine, Holleton,Hyden-Norseman Track,",,P2 - Poorly known species,,,,
31795.0,Leucopogon spectabilis,T,VU,CR,GOLD,KALGOORLIE,Helena & Aurora Range,,Threatened Flora,,,,
40804.0,Leucopogon squarrosus subsp. trigynus,2,,,SWAN,SWAN COASTAL,"Gingin, Moore River N.P.",,P2 - Poorly known species,,,,
40800.0,Leucopogon stokesii,T,CR,,MWST,GERALDTON,Arrino,,Threatened Flora,,,,
44225.0,Leucopogon subsejunctus,2,,,"SWST,WHTB","WELLINGTON,GREAT SOUTHERN",Darkan,,P2 - Poorly known species,,,,
31798.0,Leucopogon validus,1,,,WHTB,CENTRAL WHEATBELT,Parker Range,,P1 - Poorly known species,,,,
33397.0,Leucopogon wheelerae,3,,,"SWST,WARR","BLACKWOOD,DONNELLY","Augusta, Scott NP, Lake Jasper",,P3 - Poorly known species,,,,
7674.0,Levenhookia preissii,1,,,"MWST,SWAN","MOORA,PERTH HILLS,SWAN COASTAL","Cataby, Ellenbrook, Bayswter, Cannington, Leeming, Wandering",,P1 - Poorly known species,,,,
7675.0,Levenhookia pulcherrima,3,,,SCST,ESPERANCE,"Mt Gibbs, Ravensthorpe",,P3 - Poorly known species,,,,
16985.0,Lilaeopsis polyantha,2,,,"SWST,WARR","BLACKWOOD,DONNELLY","Lake Muir, ACT, Qualeup Lake",,P2 - Poorly known species,,,,
46915.0,Limnophila aromatica,3,,,KIMB,EAST KIMBERLEY,"Doongan Stn., Drysdale River Stn. Mt Elizabeth Stn., NT, QLD.",,P3 - Poorly known species,,,,
12482.0,Lindernia eremophiloides,2,,,KIMB,EAST KIMBERLEY,Purnululu N.P.,,P2 - Poorly known species,,,,
12484.0,Lindernia macrosiphonia,3,,,KIMB,EAST KIMBERLEY,"Kalumburu Mission, King Edward River, Mitchell Plateau, Roe River, Prince Regent River, King George River",,P3 - Poorly known species,,,,
48981.0,Lindernia sp. Minute-flowered (A.S. George 12433),2,,,KIMB,EAST KIMBERLEY,Prince Regent National Park,,P2 - Poorly known species,,,,
48980.0,Lindernia sp. Pilbara (M.N. Lyons & L. Lewis FV 1069),1,,,PILB,KARRATHA,"Mulga Downs, Roy Hill",,P1 - Poorly known species,,,,
60.0,Lindsaea orbiculata,2,,,KIMB,EAST KIMBERLEY,"Purnululu N.P., Drysdale River N.P.",,P2 - Poorly known species,,,,
36203.0,Liparophyllum congestiflorum,4,,,MWST,"MOORA,GERALDTON","Kalbarri, Hutt River, Eneabba",,P4 - Poorly known species,,,,
20645.0,Lissanthe scabra,2,,,"GOLD,WHTB","KALGOORLIE,CENTRAL WHEATBELT","Jaurdi Stn, Marvel Loch, Southern Cross, Frog Rock Nature Reserve",,P2 - Poorly known species,,,,
29539.0,Lissanthe synandra,1,,,SCST,ALBANY,"Bremer Bay, Groper Bluff",,P1 - Poorly known species,,,,
1039.0,Livistona alfredii,4,,,PILB,"EXMOUTH,KARRATHA","Millstream, Cave Creek, Cape Range",,P4 - Poorly known species,,,,
36862.0,Lobelia archeri,1,,,SCST,ESPERANCE,Merivale,,P1 - Poorly known species,,,,
25904.0,Lobelia leucotos,1,,,KIMB,EAST KIMBERLEY,Mt Elizabeth Stn.,,P1 - Poorly known species,,,,
16799.0,Logania archeri,1,,,SCST,ESPERANCE,E Grass Patch,,P1 - Poorly known species,,,,
16727.0,Logania nanophylla,2,,,SCST,ESPERANCE,Norseman,,P2 - Poorly known species,,,,
38000.0,Logania sylvicola,2,,,"SWST,WHTB","WELLINGTON,GREAT SOUTHERN","Collie, Kojonup, Quindanning",,P2 - Poorly known species,,,,
20278.0,Lomandra acicularis,2,,,KIMB,EAST KIMBERLEY,Prince Regent N.P.,,P2 - Poorly known species,,,,
1237.0,Lomandra ordii,4,,,WARR,"DONNELLY,FRANKLAND","Northcliffe, Walpole, Inlet River, Shannon, Gardner River, Broke Inlet",,P4 - Poorly known species,,,,
33298.0,Lomandra whicherensis,3,,,SWST,BLACKWOOD,"Whicher Range, Dardanup",,P3 - Poorly known species,,,,
11425.0,Lophostemon grandiflorus subsp. grandiflorus,3,,,KIMB,"EAST KIMBERLEY,WEST KIMBERLEY","Dampier Peninsula, Edgar Range",,P3 - Poorly known species,,,,
17625.0,Loxocarya albipes,4,,,WHTB,CENTRAL WHEATBELT,Wongan Hills,,P4 - Poorly known species,,,,
17837.0,Loxocarya gigas,2,,,MWST,MOORA,"Warradarge Hill, Alexander Morrison N.P.",,P2 - Poorly known species,,,,
13779.0,Loxocarya magna,3,,,SWST,BLACKWOOD,"Scott River, Ruabon, Whicher, Fish Road, Treeton, Carbunup, Tutunup",,P3 - Poorly known species,,,,
37320.0,Loxocarya striata subsp. implexa,1,,,SWST,BLACKWOOD,Whicher Range,,P1 - Poorly known species,,,,
19245.0,Lyginia excelsa,2,,,MWST,MOORA,"Cataby, Badgingarra N.P., Tathra N.P.",,P2 - Poorly known species,,,,
19.0,Lygodium flexuosum,3,,,KIMB,EAST KIMBERLEY,"Osborne Is., Naturalist Is., Drysdale River N.P., Prince Regent N.R.",,P3 - Poorly known species,,,,
51107.0,Lysiandra baeckeoides,3,,,GOLD,KALGOORLIE,"Laverton, Merolia Stn, White Cliffs Stn, Windimurra Station, Cashmere Downs Stn, Leinster, Banjawarn Stn",,P3 - Poorly known species,,,,
51110.0,Lysiandra fuernrohrii,3,,,GOLD,KALGOORLIE,"Wingellina Hills, NT, SA, QLD, NSW",,P3 - Poorly known species,,,,
51112.0,Lysiandra indigoferoides,1,,,KIMB,WEST KIMBERLEY,West Kimberley,,P1 - Poorly known species,,,,
6460.0,Lysinema lasianthum,4,,,"SCST,WARR","ALBANY,FRANKLAND","Porongurup Range, Albany, Collis Block, Millbrook, Nornalup, Cheyne Beach, West Cape Howe",,P4 - Poorly known species,,,,
17740.0,Lysiosepalum abollatum,T,CR,CR,WHTB,CENTRAL WHEATBELT,Wongan Hills,,Threatened Flora,,,,
19136.0,Lysiosepalum aromaticum,2,,,WHTB,GREAT SOUTHERN,Highbury SF,,P2 - Poorly known species,,,,
17847.0,Lythrum paradoxum,3,,,GOLD,KALGOORLIE,Giles,,P3 - Poorly known species,,,,
2840.0,Macarthuria georgeana,1,,,MWST,GERALDTON,Eurardy,,P1 - Poorly known species,,,,
2841.0,Macarthuria intricata,3,,,MWST,"GERALDTON,SHARK BAY","Shark Bay, Kalbarri",,P3 - Poorly known species,,,,
17106.0,Macarthuria keigheryi,T,EN,EN,"MWST,SWAN","MOORA,SWAN COASTAL","Mullering Brook, Cooljarloo, Kewdale, Forrestfield",,Threatened Flora,,,,
51282.0,Machaerina ascendens,2,,,SWST,BLACKWOOD,"Margaret River, Blackwood River NP, Leeuwin Naturaliste NP, Gingilup Swamps NR",,P2 - Poorly known species,,,,
12963.0,Macrothelypteris torresiana,1,,,KIMB,EAST KIMBERLEY,Doon Doon Stn.,,P1 - Poorly known species,,,,
2552.0,Maireana murrayana,3,,,MWST,GERALDTON,"Mt Narryer, Dairy Creek Station",,P3 - Poorly known species,,,,
2559.0,Maireana prosthecochaeta,3,,,"GOLD,KIMB,MWST,PILB","KALGOORLIE,KARRATHA,EAST KIMBERLEY,GERALDTON","Meekatharra, Cue, Mt Phillips Station, Marymia, Bulloo Downs, Lake Way Stn.",,P3 - Poorly known species,,,,
19719.0,Maireana sp. Patience (C.P. Campbell 1052),1,,,PILB,KARRATHA,Gibson Desert,,P1 - Poorly known species,,,,
20442.0,Malaccotristicha australis,2,,,KIMB,"EAST KIMBERLEY,WEST KIMBERLEY","Mitchell Falls, Sale River, Prince Regent River, Berkeley River",,P2 - Poorly known species,,,,
46593.0,Malleostemon costatus,2,,,MWST,GERALDTON,"Yerina Spring, Kalbarri NP, Binnu",,P2 - Poorly known species,,,,
42021.0,Malleostemon decipiens,1,,,MWST,MOORA,Mingenew,,P1 - Poorly known species,,,,
46825.0,Malleostemon microphyllus,2,,,MWST,GERALDTON,Nerren Nerren,,P2 - Poorly known species,,,,
46596.0,Malleostemon nephroideus,3,,,MWST,GERALDTON,"Erangy Springs, Indarra NR",,P3 - Poorly known species,,,,
46595.0,Malleostemon nerrenensis,1,,,MWST,GERALDTON,Nerren Nerren,,P1 - Poorly known species,,,,
46597.0,Malleostemon pentagonus,3,,,MWST,GERALDTON,"Nerren Nerren, Kalbarri, Mullewa",,P3 - Poorly known species,,,,
46598.0,Malleostemon pustulatus,2,,,MWST,GERALDTON,Kalbarri N.P.,,P2 - Poorly known species,,,,
16295.0,Malleostemon sp. Adelong (G.J. Keighery 11825),2,,,GOLD,KALGOORLIE,"Adelong Stn, Mt Manning, Johnston Range",,P2 - Poorly known species,,,,
14469.0,Malleostemon sp. Moonyoonooka (R.J. Cranfield 2947),2,,,MWST,GERALDTON,"Kalbarri, Geraldton",,P2 - Poorly known species,,,,
14323.0,Malleostemon sp. Officer Basin (D. Pearson 350),2,,,GOLD,KALGOORLIE,"Officer Basin, Queen Victoria Spring",,P2 - Poorly known species,,,,
20136.0,Malleostemon sp. Woodacurrie Rd (S. Patrick 3364),1,,,MWST,GERALDTON,Mullewa,,P1 - Poorly known species,,,,
16724.0,Malleostemon sp. Woolgorong Station (M. Officer 100),1,,,MWST,GERALDTON,Woolgorong,,P1 - Poorly known species,,,,
16726.0,Malleostemon sp. Yalgoo Road (Morawa Tree Committee 329),1,,,MWST,GERALDTON,"Morawa, Gutha",,P1 - Poorly known species,,,,
13812.0,Margaritaria dubium-traceyi,1,,,KIMB,EAST KIMBERLEY,"Bouganville Peninsula, NT, QLD",,P1 - Poorly known species,,,,
35522.0,Marianthus aquilonaris,T,CR,,SCST,ESPERANCE,"Bremer Range, Ravensthorpe Range",,Threatened Flora,,,,
25808.0,Marianthus dryandra,2,,,WHTB,GREAT SOUTHERN,Dryandra SF,,P2 - Poorly known species,,,,
17638.0,Marianthus granulatus,4,,,SCST,ALBANY,Porongurup Range,,P4 - Poorly known species,,,,
25807.0,Marianthus mollis,4,,,SCST,"ALBANY,ESPERANCE","Ravensthorpe, Carlingup",,P4 - Poorly known species,,,,
25819.0,Marianthus paralius,T,EN,EN,SWAN,SWAN COASTAL,Seabird,,Threatened Flora,,,,
33638.0,Meionectes tenuifolia,3,,,"MWST,SWAN,SWST","MOORA,PERTH HILLS,SWAN COASTAL,WELLINGTON","Ruabon, Maddington, Harvey, Pinjarra, Upper Swan, Gingin, Cooljarloo, (Woorooloo, Midland, Byfields Mill), Mt Helena",,P3 - Poorly known species,,,,
5871.0,Melaleuca agathosmoides,1,,,"SCST,WHTB","ESPERANCE,GREAT SOUTHERN","Hatter Hill, Lake King",,P1 - Poorly known species,,,,
12385.0,Melaleuca apostiba,3,,,GOLD,KALGOORLIE,"Carnegie Hstd - Giles, Lake Minigwal",,P3 - Poorly known species,,,,
18275.0,Melaleuca barlowii,3,,,MWST,GERALDTON,"Latham, Koolanooka Hills, Yandanooka, Morawa",,P3 - Poorly known species,,,,
5877.0,Melaleuca basicephala,4,,,"SWST,WARR","BLACKWOOD,FRANKLAND","Scott River, Jangardup, D'Entrecasteaux, Gingilup, D'Enrecasteau NP, Pingerup Plains",,P4 - Poorly known species,,,,
19382.0,Melaleuca boeophylla,2,,,MWST,GERALDTON,"Kalbarri, Overlander Roadhouse",,P2 - Poorly known species,,,,
5891.0,Melaleuca coccinea,3,,,"GOLD,SCST","KALGOORLIE,ALBANY,ESPERANCE","Karonie, Boulder, Widgiemooltha, Erayinia Hill, Norseman, Ravensthorpe",,P3 - Poorly known species,,,,
15693.0,Melaleuca dempta,3,,,SCST,ESPERANCE,"Scaddan, Fleming, Dalyup",,P3 - Poorly known species,,,,
15781.0,Melaleuca eximia,2,,,SCST,ESPERANCE,"Mt Burdett, Wittenoom Hill",,P2 - Poorly known species,,,,
13269.0,Melaleuca fissurata,4,,,"SCST,WHTB","ESPERANCE,GREAT SOUTHERN","Mt Ney - Lake King, Scaddan, Truslove, Mt Ridley",,P4 - Poorly known species,,,,
37645.0,Melaleuca genialis,2,,,WHTB,GREAT SOUTHERN,Dongolocking N.R.,,P2 - Poorly known species,,,,
19450.0,Melaleuca grieveana,1,,,WHTB,CENTRAL WHEATBELT,"Cowcowing, Narembeen, Parker Range, Wyalkatchem",,P1 - Poorly known species,,,,
13270.0,Melaleuca huegelii subsp. pristicensis,3,,,MWST,SHARK BAY,"Shark Bay, Dirk Hartog Island, Tamala",,P3 - Poorly known species,,,,
19451.0,Melaleuca huttensis,3,,,MWST,"MOORA,GERALDTON","Hutt River, Coronation Beach, Kalbarri N.P., Gerladton, Northampton, Howatharra",,P3 - Poorly known species,,,,
16006.0,Melaleuca incana subsp. Gingilup (N. Gibson & M. Lyons 593),2,,,SWST,BLACKWOOD,Gingilup Swamp,,P2 - Poorly known species,,,,
14701.0,Melaleuca macronychia subsp. trygonoides,3,,,"GOLD,SCST","KALGOORLIE,ESPERANCE","Lake View Rock, McDermid Rock, Queen Victoria Rock, Cave Hill",,P3 - Poorly known species,,,,
19521.0,Melaleuca manglesii,1,,,"SWAN,WHTB","PERTH HILLS,CENTRAL WHEATBELT","Meckering, Kellerberrin, Cowcowing, Tammin",,P1 - Poorly known species,,,,
5937.0,Melaleuca micromera,3,,,"SCST,WARR,WHTB","ALBANY,DONNELLY,GREAT SOUTHERN","Stirling Range, Kendenup, Warriup, S Mt Barker, Ross Peak, Tunney, Perup",,P3 - Poorly known species,,,,
5940.0,Melaleuca nanophylla,3,,,GOLD,KALGOORLIE,Great Victoria Desert,,P3 - Poorly known species,,,,
37646.0,Melaleuca ochroma,3,,,"SCST,WHTB","ESPERANCE,GREAT SOUTHERN,CENTRAL WHEATBELT","Hyden, Frank Hann N.P., Mt Holland",,P3 - Poorly known species,,,,
5945.0,Melaleuca oldfieldii,2,,,MWST,GERALDTON,Kalbarri,,P2 - Poorly known species,,,,
13274.0,Melaleuca ordinifolia,2,,,"SCST,WARR,WHTB","ALBANY,FRANKLAND,GREAT SOUTHERN","Cranbrook - Hamersley River, Stirling Range NP, Hay River",,P2 - Poorly known species,,,,
15782.0,Melaleuca penicula,4,,,SCST,ALBANY,"Fitzgerald River N.P., Ravensthorpe",,P4 - Poorly known species,,,,
5950.0,Melaleuca polycephala,3,,,"SCST,WHTB","ALBANY,GREAT SOUTHERN","Pingrup, Kuringup, Gnowangerup, Ongerup, Amelup, Toolbrunup Siding, Dragon Rocks, Borden",,P3 - Poorly known species,,,,
13276.0,Melaleuca pritzelii,3,,,"SCST,SWST,WARR,WHTB","ALBANY,DONNELLY,WELLINGTON,GREAT SOUTHERN","Ongerup, Pootenup, Tambellup, Fitzgerald River NP, Quarderwardup Lake, Lake Muir, Cordering, Stirling Range National Park, Ewlyamartup",,P3 - Poorly known species,,,,
5962.0,Melaleuca sciotostyla,T,EN,EN,WHTB,CENTRAL WHEATBELT,"Wongan Hills, Cadoux",,Threatened Flora,,,,
5963.0,Melaleuca sclerophylla,3,,,"MWST,SWAN,WHTB","MOORA,GERALDTON,PERTH HILLS,CENTRAL WHEATBELT","Manmanning, Marchagee, Wongan Hills, New Norcia, Dalwallinu, Moora, Miling, Morawa, Caljie",,P3 - Poorly known species,,,,
13278.0,Melaleuca sculponeata,3,,,"SCST,WHTB","ALBANY,GREAT SOUTHERN","W of Ravensthorpe, Lake King",,P3 - Poorly known species,,,,
19608.0,Melaleuca similis,1,,,SCST,ESPERANCE,"Young River, Ravensthorpe",,P1 - Poorly known species,,,,
37647.0,Melaleuca sophisma,1,,,SCST,ALBANY,Kundip,,P1 - Poorly known species,,,,
33022.0,Melaleuca sp. Wanneroo (G.J. Keighery 16705),T,EN,EN,SWAN,SWAN COASTAL,Wanneroo,,Threatened Flora,,,,
37683.0,Melaleuca viminalis,2,,,KIMB,"EAST KIMBERLEY,WEST KIMBERLEY","Prince Regent River N.R., Kununurra",,P2 - Poorly known species,,,,
13279.0,Melaleuca viminea subsp. appressa,2,,,"SCST,WHTB","ALBANY,ESPERANCE,CENTRAL WHEATBELT","Mt Burdett, Ongerup, Skeleton Rock",,P2 - Poorly known species,,,,
41786.0,Melichrus sp. Bruce Rock (J. Buegge D 36),1,,,WHTB,GREAT SOUTHERN,Bruce Rock,,P1 - Poorly known species,,,,
41785.0,Melichrus sp. Bungalbin Hill (F.H. & M.P. Mollemans 3069),3,,,"GOLD,MWST,WHTB","KALGOORLIE,GERALDTON,CENTRAL WHEATBELT","Between Bimbigy and Diemals, Helena Aurora Range, Kiralocka Stn., Windarling, Ninghan Stn., Jackson Range,Mdiemals Stn., Mount Manning",,P3 - Poorly known species,,,,
41784.0,Melichrus sp. Coolgardie (K.R. Newbey 8698),1,,,GOLD,KALGOORLIE,Coolgardie,,P1 - Poorly known species,,,,
3051.0,Menkea draboides,3,,,"GOLD,MWST,SCST,WHTB","KALGOORLIE,ESPERANCE,MOORA,GERALDTON,CENTRAL WHEATBELT","Watheroo, Yilgarn, Meekatharra, Paynes Find, Yardina Rock",,P3 - Poorly known species,,,,
3052.0,Menkea lutea,1,,,GOLD,KALGOORLIE,"Blackstone Range, Tompkinson Range",,P1 - Poorly known species,,,,
11623.0,Mesomelaena stygia subsp. deflexa,3,,,MWST,MOORA,"Eneabba, Yandanooka Hill, Arrino",,P3 - Poorly known species,,,,
34679.0,Micraira brevis subsp. Theda (M.D. Barrett 1505),2,,,KIMB,EAST KIMBERLEY,"Theda Stn., Drysdale River N.P.",,P2 - Poorly known species,,,,
34678.0,Micraira brevis subsp. brevis,3,,,KIMB,"EAST KIMBERLEY,WEST KIMBERLEY","Mt Elizabeth Stn., Prince Regnet N.R.",,P3 - Poorly known species,,,,
35059.0,Micraira sp. Harding Range (M.D. Barrett & R.L. Barrett MDB 1827),1,,,KIMB,WEST KIMBERLEY,Harding Range,,P1 - Poorly known species,,,,
29181.0,Micraira sp. Purnululu (M.D. Barrett & R.L. Barrett 1507),1,,,KIMB,EAST KIMBERLEY,"Ragged Range, Osmond Range",,P1 - Poorly known species,,,,
6889.0,Microcorys cephalantha,3,,,WHTB,GREAT SOUTHERN,"Kulin, Jitarning, Dudinin, Wedin, Wickepin, Bendering",,P3 - Poorly known species,,,,
50147.0,Microcorys elatoides,1,,,WHTB,CENTRAL WHEATBELT,Hyden,,P1 - Poorly known species,,,,
6890.0,Microcorys eremophiloides,T,VU,VU,WHTB,CENTRAL WHEATBELT,"Wongan Hills, Konningorring, Ejanding",,Threatened Flora,,,,
6896.0,Microcorys longiflora,3,,,SCST,"ALBANY,ESPERANCE","Cape Riche, Mt Drummond, Thumb Peak, Jerramungup, Eyre Range",,P3 - Poorly known species,,,,
18317.0,Microcorys sp. Boxwood (K.R. Newbey 4200),1,,,SCST,ALBANY,"Boxwood Hill, Kamballup",,P1 - Poorly known species,,,,
18316.0,Microcorys sp. Forrestania (V. English 2004),4,,,WHTB,CENTRAL WHEATBELT,"Mt Holland, Forrestania",,P4 - Poorly known species,,,,
50781.0,Microcorys sp. Great Victoria Desert (J. Alford s.n. PERTH 09041567) PN,2,,,GOLD,KALGOORLIE,Great Victoria Desert NR,,P2 - Poorly known species,,,,
49411.0,Microcorys sp. Mt Holland broad-leaf (G. Barrett s.n. PERTH 04104927),1,,,WHTB,CENTRAL WHEATBELT,Mt Holland,,P1 - Poorly known species,,,,
50437.0,Microcorys sp. Parker Range (C. Hancock s.n. PERTH 09215123) PN,2,,,WHTB,CENTRAL WHEATBELT,"Forrestania, Mt Holland, Jilbadji N.R.",,P2 - Poorly known species,,,,
29533.0,Microcorys sp. Stirling Range (S. Barrett 1392),2,,,SCST,ALBANY,Stirling Range,,P2 - Poorly known species,,,,
18315.0,Microcorys sp. Tarin Rock (E.J. Croxford 5251),2,,,WHTB,GREAT SOUTHERN,"Kukerin, Tarin Rock",,P2 - Poorly known species,,,,
6903.0,Microcorys tenuifolia,3,,,"MWST,WHTB","MOORA,GERALDTON,CENTRAL WHEATBELT","Morawa, Kalbarri NP, Yuna, Wongan Hills, Marchagee",,P3 - Poorly known species,,,,
6905.0,Microcorys wilsoniana,1,,,SCST,ALBANY,"Mt Short, Tarin Rock and Ravensthorpe Range",,P1 - Poorly known species,,,,
13786.0,Microcybe pauciflora subsp. grandis,1,,,SCST,"ALBANY,ESPERANCE","Hatter Hill, Bandalup Hill",,P1 - Poorly known species,,,,
34201.0,Microcybe sp. Windy Hill (G.F. Craig 6583),3,,,"SCST,WHTB","ESPERANCE,CENTRAL WHEATBELT","Bremer Range, Lake Medcalf, Jilbadji N.R.",,P3 - Poorly known species,,,,
45235.0,Microlepidium alatum,1,,,SCST,ESPERANCE,Eucla,,P1 - Poorly known species,,,,
30412.0,Micromyrtus acuta,3,,,MWST,GERALDTON,"Paynes Find, Warriedar, Lake Monger, White Wells, Blue Hill Range",,P3 - Poorly known species,,,,
29554.0,Micromyrtus chrysodema,1,,,GOLD,KALGOORLIE,Leinster,,P1 - Poorly known species,,,,
37680.0,Micromyrtus collina,1,,,MWST,GERALDTON,Moresby Range,,P1 - Poorly known species,,,,
20544.0,Micromyrtus elobata subsp. scopula,3,,,SCST,ESPERANCE,"Kumarl, Balladonia, Neridup, Mt Buraminya, Kau Rock NR",,P3 - Poorly known species,,,,
35164.0,Micromyrtus greeniana,1,,,MWST,GERALDTON,Eurady Stn.,,P1 - Poorly known species,,,,
5996.0,Micromyrtus helmsii,1,,,GOLD,KALGOORLIE,Near Mt Squires,,P1 - Poorly known species,,,,
